,centroid,clusters
449,virtual vector,"Banach vector, actual tensor, dual vector, graded vector, normal vectors, parallel vectors, real vector, virtual excited, virtual meson, virtual vector"
450,embeddings,"Embedding, embedding, embeddingC-stack, embeddings, embeddingsee"
451,exists,exists
452,gluing,"Arguing, Fluid, Gluing, Ignoring, Klein, Pulling, genuine, giving, gluing, gluons, solving"
453,fixed,fixed
454,categories,"Categories, bicategories, categorical, categories, categories Cat, categories Fukaya, categoryderived"
455,quasicoherent,"Quasicoherent, quasicoherent, virtual quasicoherent"
456,underlying,"Underlying, energyQnuc, underlying, underlying Boolean, underlying map, underlying partial, uniformly using"
457,composition,"Compositio, Compositio Math, Composition, Compositions, comparison, composition, composition map, composition written, compositions, opposite sign"
458,map,map
459,smooth maps,"Sc-smoothness, Smooth maps, smooth Fano, smooth complex, smooth inverse, smooth map, smooth maps, smooth path, smooth spaces, smooth stacks"
460,homology,"Kolmogorov, Scott-Solovay, Topology, cohomology, homology, homotopy, pathology, phenomenology, topology"
461,results,results
462,Kuranishi spaces,"Banach spaces, Kuranishi space, Kuranishi spaces, Kuranishi spacesKuranishi, certains espaces, spacesKuranishi space, spacesKuranishi spacevirtual"
463,bundle,bundle
464,immersions,"Dixmier Dixbook, S-immersions, Submersions, Timmermans, exist immersions, immersion, immersions, immersions and/or, submersions, w-immersions"
465,finite group,"Nijmegen group, define group, finite Radon, finite diagrams, finite group, finite groups, finite join, finite subgroup, isotropy group, lattice groups, six-parameter group"
466,moduli,"Mochizuki, Modulo, Tomusiak, mapsmoduli, modular, modularity, module, moduli, modulo, modulo null, mostly"
467,differential,"Differentiable, Differential, differentiable, differential, differentials, differentiation"
468,moduli spaces,"moduli cycle, moduli schemes, moduli space, moduli spacemoduli, moduli spaces, moduli spacesmoduli, moduli stacks, modulo meager, product spaces, stonian spaces, total space"
469,corner functors,"Define functors, corner functor, corner functors, corner functorsd-space, corners functors, corners vector, covariant functor, define functors, weaker functorial"
470,cotangent sheaf,"coherent sheaves, cotangent sheaf, cotangent sheafd-space, cotangent sheafd-stack, cotangent sheaves, quotient sheaf"
471,principal d-orbifold,"cornersprincipal d-orbifold, principal G-bundle, principal d-manifold, principal d-manifolds, principal d-orbifold, principal d-orbifolds, trivial orbifold"
472,Remark,"Ramani, Remark, Remarkconj, Remarkrem, Research, remark, remarks"
473,d-transverse,"Transverse, admit transverse, b-transverse, bd-transverse, c-transverse, cd-transverse, d-transverse, hence bd-transverse, local transverse, transverse, transversely"
474,sufficient,"coefficient, coefficient"", coefficients, efficiency, insufficient, s-s sufficiently, sufficiency, sufficient, sufficiently, useful sufficient"
475,write,write
476,information,"Enumeration, basic information, deformation, deformations, extra information, global information, informally, information, informationsav-nu, local information, minimal information, reformulation, uniformization"
477,model',"Models, model, model', models, modest"
478,orbifold bordism,"Orbifold cobordism, d-orbifold bordism, orbifold bordism, orbifold bordismbordism, orbifold cobordism, orbifold stratabordism, orbifolds holds, orbifoldsbordism"
479,virtual cotangent,"bundlevirtual cotangent, orbifold cotangent, virtual cotangent, virtual fundamental"
480,virtual dimension,"develop dimension, virtual dimension, virtual dimensiond-orbifold, virtual dimensionfibre"
481,ijk,"Birk, Moerdijk, Pick, Sick, iVVb, iff, ij/, ijV, ijk, ijk', ijl, ikl, iso, itA, jkl, k-k, n-k, pick"
482,bundle,bundle
483,corners standard,"corners boundary, corners standard"
484,iii,"ii', iii, vii, viii"
485,separated,"Separated, searched, separable, separate, separated, separatedC-stack, separately"
486,symplectic geometry,"Symplectic Geometry, geometrysymplectic geometry, symplectic geometers, symplectic geometry, symplectic geometrysymplectic"
487,w-submersion,"s-submersion, s-submersions, simple submersion, submersion, sw-submersion, w-submersion, w-submersions, weak submersion"
488,Spivak's,"David Spivak, Glivenko's, Sakai Sakai, Spiv Spivak's, Spivak, Spivak Spiv, Spivak's, Spivak's theory, SpivakSpiv, reading Spivak's, seeSpivak's"
489,Zariski topology,"String Topology, Stringy Topology, Zariski locally, Zariski topology, Zariski topologyZariski, etale topology, topologyZariski topology"
490,locally fair,"local fibre, locally closed, locally compact, locally fair, locally fairC-scheme, locally maps, locally trivial"
491,cover,"Coker, Dover, Hofer, Moer, Moreover, November, Polar, cover, covered, covers, eevert, newcomer, recover"
492,d-orbifold standard,"d-manifold standard, d-orbifold standard, d-orbifold structures, sd-manifold standard, sd-orbifold standard, td-orbifold standard"
493,disjoint,"Disjoint, Vistoli Vist, adjoint, disjoint, disjointness, distort, pairwise disjoint"
494,instance,"Hahn-Banach, eigenspace, ignorance, instance, instance Dubuc, instantaneous"
495,quasicoherent sheaf,"Quasicoherent sheaves, quasicoherent sheaf, quasicoherent sheaves"
496,relation,"Helton, Relation, Zealandigor, behaviour, correlation, free action, free pion, reactions, realization, relation, relations, relationship, relaxation"
497,addition,"Additionally, addition, addition induced, additional, additive, additivity, edition, edition"""
498,independent,"dependent, independent, independent proof, per independent, radial dependence, sign depending, signs depending, spin-dependent"
499,satisfy,"Latifi, data satisfy, ijk satisfy, satisfy"
500,universal,"D-universal, D-universality, Universalis, underway, univariate, universal, universal monoid, universality, universally, universe, universeVzzVB, universes"
501,universal property,"multivariable operator, trivial property, uniqueness property, universal property, universal propertycategory, useful property"
502,Gromov--Witten invariants,"Gromov--Witten d-orbifold, Gromov--Witten invariant, Gromov--Witten invariants, Gromov--Witten theory, Seiberg--Witten invariants, invariantsGromov--Witten invariants"
503,J-holomorphic curves,"J-holomorphic curves, J-holomorphic curvesd-orbifold, J-holomorphic curvesmoduli, J-holomorphic stable"
504,Kuranishi neighbourhood,"Kuranishi neighbourhood, Kuranishi neighbourhoods, infinitesimal neighbourhood"
505,automatically,"Suppose finally, analytically, automatically, autonomous partially, axiomatically, developed axiomatically, dual partially, happens automatically, holds automatically, systematically, treat systematically"
506,differential geometry,"Differential Geometry, differential bordism, differential geometry, differential geometry', differential geometrysynthetic, differential graded, differential-geometric"
507,exact sequence,"exact sequence, exact sequenceabelian, exact sequencesplit, exact solvable, exactly equal, finite sequence, inductively sequences, nondecreasing sequence, sequence sequence, spectral sequence"
508,natural isomorphism,"lattice isomorphism, natural isomorphism, natural isomorphismcategory, natural isomorphismfunctor, natural isomorphisms, natural morphism, naturally isomorphic, strict isomorphism"
509,square zero,"equal zero, idealsquare zero, square matrices, square root, square zero, squareCartesian, squared ideals"
510,taking,"Nakano, Taking, taking, talking, thank Ingo"
511,weakly,"Clearly, Kelly, greatly, heavily, imposed weakly, merely, weak, weakly, wholly, widely, wiggly"
512,alternative,"Alternatively, aller Stetigen, alternate, alternative, alternatives, attractive, scale relative"
513,author,"Aut coh, Hartshorne, Hausdorff, Mumford, and/or, author, author's, authors, auto--, auto-BT, pushout"
514,canonical isomorphism,"canonical diffeomorphism, canonical diffeomorphisms, canonical isomorphism, canonical isomorphisms, canonically isomorphic, local isomorphism, non-canonical isomorphism"
515,conormal bundle,"M-polyfold bundle, canonical bundle, conormal bundle"
516,corners fibre,"corners corner, corners dOrbb, corners fibre, corners fixed, corners flat, corners k-corners, corners simple, ones LlibreZhang, preserves fibre"
517,cotangent bundle,"cotangent bundle, cotangent bundles, cotangent bundlevirtual, cotangent vector"
518,equivalence relation,"equivalence identifies, equivalence relation, equivalence relations, equivalences conditions, equivalences natural, equivalent skeletal, equivariance conditions, recurrence relation"
519,extra conditions,"chain condition, chain conditions, dual condition, extra assumptions, extra condition, extra conditions, extra vanishing, initial conditions, local condition, mild conditions, no-log conditions, overlap conditions, required conditions, weaker conditions"
520,identifies,"densities, identified, identifies, identifies names, identities, quantities"
521,sf-immersion,"exist sf-immersions, s-immersion, sf- immersions, sf-immersion, sf-immersions, sf-immersions and/or, sfw-immersion, sheaf version, sw-immersion, w-immersion"
522,stack,"Stacks, stack, stacks, start"
523,union,"Fulton, Indian, Kubon, Melnikov, Russian, Simon, Vinnikov, opinion, pion, putnzzn, stonian, union, unions, unknown, unknowns"
524,virtual class,"Virtual classes, conjugacy class, conjugacy classes, suitable class, theoryvirtual class, vertical areas, virtual chain, virtual chains, virtual class, virtual classes, virtual cycles, virtual moduli"
525,write,write
526,Lagrangian,"Grassmannian, Lagrangian, Lagrangian Floer, MacLane MacL, Riemannian, embedded Lagrangian"
527,bordism group,"Garching groupd-p, bordism agrees, bordism group, bordism groups, bordism ring, d-bordism group"
528,corners s-embedding,"Bernau's embedding, characterize embeddings, corners embedding, corners s-embedding, corners sf-embedding, corners sfw-embedding, corners sw-embedding, corners w-embedding, order-embedding"
529,explicit,"Explicitly, explicit, explicitly, implicit, pseudolimit"
530,generalize,"centralizer, emphasize, enumerative, generality, generalize, generalized, generalizes, generally, generating, seeDeligne--"
531,map,map
532,oriented d-manifold,"Orientationsd-manifold, associated d-manifold, defined d-manifold, options d-manifold, orientationd-manifold, oriented d-manifold, oriented d-manifolds, oriented manifold, oriented manifolds"
533,similar,"Seminar, Similar, annihilator, bipolar, divisor, familiar, seminal, similar"
534,submanifold,"d-submanifold, d-submanifolds, seemanifold, submanifold, submanifolds, supermanifold"
535,arXiv,"Darwin, arXiv, arrive"
536,convention,"Slovenian, Wolfenstein, abovementioned, concatenation, concentrate, connection, convection, convection term, convention, conventional, conventions, converging, conversations"
537,d-orbifoldsd-orbifold,"M-polyfoldsd-orbifold, d-manifold d-orbifold, d-orbifold d-orbifold, d-orbifoldd-orbifold, d-orbifoldsd-orbifold, d-orbifoldsorbifold, d-suborbifoldsd-orbifold, define orbifoldsorbifold, orbifolds d-orbifold, orbifoldsd-orbifold"
538,disjoint unions,"Disjoint unions, disjoint families, disjoint sums, disjoint union, disjoint unions, distinct indices, distinct unimodular, showing regions"
539,exist,exist
540,ideal,"Ideals, Sideal, Widely, deal, ideal, ideal azznr, ideals, ideas"
541,induces,"binds nuclei, indices, induce, induced, induces, inducing, mandates"
542,inverse,"Inverse, iidense, inTarski, increase, inverse, inverses, isdense, quasi-inverse"
543,stable,"Movable, Stab supp, Stable, System aller, absolute absolute, adjustable, enable, enables, etale, fillable, ifstably, movable, noticeable, prestable, putabzzvaeqb, solvable, stabilizer, stable, stable pairs, stably, style, suitable, symbol, symbols, unable, usable, via stable"
544,surjective morphism,"injective morphism, projection morphisms, subjective estimateradius, surjective exactly, surjective impose, surjective morphism"
545,abelian category,"CSchlfssc category, Segal category, abelian category, abelian categoryabelian, abelian seeabelian, abelian subcategory, categoryabelian category, derived category, groupoids category, opposite category, ordinary category, seeabelian category, sequenceabelian category, simplicial category, skeletal category---a"
546,bordism d-orbifold,"bordism d-manifold, bordism d-orbifold, bordism effectiveorbifold, bordism groupd-orbifold, bordism orbifold, bordismbordism orbifold, bordismd-orbifold, isomorphism d-orbifold, stratabordism d-orbifold, studying d-orbifold"
547,closed,closed
548,complete,complete
549,complicated,"accomplished, ampliated, complicated, sophisticated"
550,construct,"BeFa construct, construct, constructed, constructs, reconstructs"
551,corners s-immersion,"corners immersion, corners s-immersion, corners sf-immersion, corners sfw-immersion, corners sw-immersion, corners w-immersion, proper w-immersion"
552,fixed,fixed
553,group morphism,"closed morphism, group Dedekind, group morphism, group morphisms, groups trivial, groupsbordism, order-automorphism, product morphisms, proper morphism, zero morphism"
554,limits,"Ablowitz, Limits, Schmitt, WDim---with, bilimits, colimits, digits, highlights, lax limits, limit, limit step, limits, lithium, mimics, pi-mass, pseudolimits"
555,makes,"Baker, Ermakov, Fokas, James, Names, Takeuti, images, makes, marked, masses, matches, names, rates, takes, waves"
556,map,map
557,notion,"Gordon, Knutson, Tot Tot, motion, noticing, notion, notions"
558,overlaps,"Los Alamos, overall, overlap, overlaps, overlooked"
559,products exist,"Graduate Texts, product uses, productbordism, products commute, products exist, productsbordism, productsfibre"
560,projections,"Projection, Projections, group actions, projection, projection onto, projection-like, projections, projections"", projectionsBoolean, projective plane, projectivity"
561,strictly functorial,"strata functoriality, strict functoriality, strictly functorial, strictly functorialorbifold, strictly increasing, strongly functorial, weakly functorial"
562,strongly transverse,"Strongly representable, section transversely, strongly advocated, strongly representable, strongly transverse, strongly transverseorbifold"
563,subcategory,"fullcategory, quasicategory, squarecategory, subcategories, subcategory"
564,weakly injective,"Arnold Conjecture, bundle injective, real projective, weakly injective, weakly surjective"
565,Furthermore,Furthermore
566,corners equivalent,"corners equivalence, corners equivalent, gives equivalent, longer equivalent"
567,derived algebraic,"Derived Algebraic, Invariant algebraic, Unified Algebraic, derived algebraic, derived categoryderived, purely algebraic, richer algebraic"
568,diffeomorphisms,"diffeomorphic, diffeomorphism, diffeomorphisms, diffeomorphisms commute, diffeomorphisms orbifold"
569,discuss,"Piskunov, discard, discards, discuss, discussing, discussion, displays, dispute"
570,essentially,"Essentially, essential, essential change, essentially, essentially takes, essentially trivial, essentially uniquely"
571,map,map
572,modules,"Igor Klep, Kowalevski, Modules, Modules"", Voiculescu, hopeless, massless, modeled, modelled, modules, modulesmodule, modulesring"
573,normal,"Extremal, Formally, Journal, anomaly, conormal, enormous, formal, formal sum, format, moral, normal, normal cone, normalizer, nowadays, tutorial"
574,operations,"Operations, fewer axioms, fibrations, n-fold operation, noperations, operation, operations, options, permutations, sum operation, torus actions"
575,pullbacks,"Pullbacks, pullback, pullback gives, pullback sheaf, pullbacks"
576,quasi-smooth,"exists smooth, flat smooth, quasi-smooth, sc-smooth, scheme quasi-smooth, stack quasi-smooth, using smooth"
577,special,"Special, Tracial, crucial, especially, pencil, pkszzcal, skeletal, special, spherical, subpencil"
578,sw-embedding,"desired embedding, flat embedding, lower embedding, main embedding, s-embedding, s-embeddings, sf-embedding, sf-embeddings, sfw-embedding, study embeddings, sw-embedding, w-embedding, w-embeddings"
579,category abelian,"category NzzSIR, category abelian, categoryabelian, objectcategory terminal, squarecategory Cartesian"
580,closed,closed
581,component,"component, components, exponent, multi-component"
582,coordinate systems,"Coordinate Unitary, coordinate system, coordinate systemgood, coordinate systems, coordinate systems', coordinate systemsgood, coordinate unitary"
583,corners orbifold,"closed suborbifolds, comment orbifold, compact orbifold, corners d-orbifold, corners d-suborbifold, corners orbifold, corners seeorbifold, corners' properly, cornersd-orbifold, cornersorbifold, coverorbifold, gives orbifold"
584,corners orientations,"construct orientations, convention orientation, conventions orientation, corners definition, corners orientation, corners orientations, define orientations, model orientations, preserves orientations, preserving orientations, products orientations"
585,cotangent module,"complemented modular, cotangent module, cotangent modules, cotangent modulesmodule"
586,difficult,"becomes difficult, difficult, difficulties, difficulty, merely difficult"
587,effective orbifold,"effective actions, effective d-orbifold, effective d-orbifolds, effective orbifold, effective orbifolds, effective version, effectived-orbifold, effectiveorbifold, effectiveorbifold orbifold, noneffective orbifolds"
588,equivalent,equivalent
589,exist,exist
590,fixed,fixed
591,generated,generated
592,model' d-orbifolds,"consider d-orbifolds, model d-orbifold, model d-orbifolds, model' d-manifold, model' d-manifolds, model' d-orbifold, model' d-orbifolds, quotient d-orbifolds"
593,orientation convention,"Grassmannian completion, orientation convention, orientation conventions, orientation-preserving, orientations equations"
594,partition,"Cartesian, Partitions, cartesian, parities, particles shown, partition, partitions, per million, variation"
595,parts,"Apart, Carlo, Hart, Paris, Parts, Reports, Varga, apart, barspsa, charts, darcy, parties, partly, parts, parts per, past, quarks, upwards"
596,proof,proof
597,regard,"Bigard, MoPr regard, Regard, Reinhardt, Segur, backward, prepare, record, records, regard, regarded, regularly, upward"
598,restrict,"Abstract, Festschrift, abstract, abstracts, restrict, restricted, restricts, strict, test discrete, test iff, test restricts"
599,result,result
600,semieffective d-orbifold,"algebraic curvesd-orbifold, semieffective d-orbifold, semieffective d-orbifolds, semieffective orbifold, semieffectived-orbifold, semieffectived-orbifold effective"
601,well-defined,"uniquely defined, well-behaved, well-defined, well-defined follows, well-founded, well-founded rationale, well-ordered, well-organized, zero derived"
602,C-scheme,"C-scheme, C-schemes, CIME school, CosPDEhyper, Druschel, LetC-scheme, Quot schemes, closedC-scheme, dg-scheme, dg-schemes, elsewhere, fairC-scheme, properC-scheme"
603,Furthermore,Furthermore
604,Sata,"CSta, ChRu Sata, Fukaya, Gabay, Iwasaki, LaGa, MoPr Sata, Nagoya, Ohta, Ozawa, SLa, Sakai, Santa, Sata, Sata Thur, Satake, Satsuma, Satz, Sauer, Sffa, Shabat, Sta, Stab, Yukawa, Zalar, dSpa dSta, dSta, data"
605,Symplectic,"Symplectic, Symplectic Field, Symplectic Geom, symplectic"
606,abelian category,abelian category
607,algebraic,algebraic
608,b-transverse fibre,"Transverse fibre, b-transverse fibre, b-transversed-stack, b-transversefibre, b-transversefibre product, bd-transverse fibre, bd-transversefibre, bd-transversefibre product, c-transverse fibre, d-transverse fibre, transverse fibre"
609,combining,"Combining, combinations, combined using, combining, combining Example"
610,compact oriented,"Compact oriented, compact Hausdorff, compact convex, compact oriented"
611,corners principal,"corners principal, cornersprincipal, d-spaces principal, model' principal, nonempty principal, symmetry principles"
612,d-substack,"C-substack, d-subspace, d-substack, d-substacks"
613,derivative,"cross-derivative, derivation, derivative, derivatives, exterior derivative, lower derivatives"
614,dg-algebras,"dg-algebra, dg-algebras"
615,generated,generated
616,geometric structure,"MeasurementsThe Structure, algebraic structure, geometric structure, geometric structures"
617,orbifold groups,"orbifold group, orbifold groupC-stack, orbifold groups, orbifold groupsC-stack"
618,orbifold orbifold,"Orbifolds orbifold, Orbifoldsorbifold, d-orbifold orbifold, orbifold d-orbifold, orbifold orbifold, orbifolds orbifold, orbifoldsorbifold, stratad-orbifold orbifold, strataorbifold orbifold, suborbifoldorbifold, suborbifoldsorbifold"
619,polyfolds,"M-polyfold, M-polyfolds, polarpolar, polyfold, polyfolds"
620,quadruple,"Pura Appl, quadruple, quadrupole, quintuple, quintuples, sum rule"
621,quotient d-stacks,"equivalent d-stacks, quotient C-stack, quotient d-stack, quotient d-stacks, quotient stack, quotient stacks, strataquotient d-stackd-stack"
622,ring,"BingRen, C-ring, C-rings, Fig, Frink, Lin, Niering, Rings, Rings"", Sprung, String, Stringy, Turning, Wiringa, Wong, Xiang, brings, d-nu, ind, reine, ring, ringed, rings, runs, tiny, trying, wrong"
623,scheme,"achieve, scheme, schemes, theme"
624,subset,subset
625,triples,"Bruxelles, Khriplovich, XzzplusY, articles, dipoles, gzzplus, retrieves, stable triples, tricks, triple, triple Fuchs, triple index, triples"
626,Lecture,"Lecture, Lectures, lecture, perturb, picture"
627,abelian group,"Abelian Groups, abelian direct, abelian group, abelian groups, stabilizer group"
628,advantage,"advantage, enormous advantage, major advantage"
629,algebraic,algebraic
630,algebraic,algebraic
631,boundary components,"boundary component, boundary components, energy components, expendable commodity, monodromy exponents, nonzero component"
632,boundaryd-stack,"boundary seed-stack, boundaryd-space, boundaryd-stack, corners boundaryd-stack, holds d-stack"
633,classical bordism,"Classical bordism, classical bordism, classical concepts, classical facts, classical program, classical study"
634,complex structure,"associated structure, bundle structure, canonical structure, commutes strictly, complex projective, complex structure, complex structures, complicated structure, pre-espalier structure"
635,conventional algebraic,"Fundamental algebraic, conventional algebraic, conventional derived"
636,corners include,"areas include, authors include, collection includes, considered inFillmore, corners analogue, corners include, possibly include, purpose include"
637,cornersd-stack,"contexts---abstract, corners D-stacks, corners d-space, corners d-stack, corners seed-stack, cornersd-space, cornersd-stack, coverC-stack, coverd-stack, inertia stack, morphismC-stack, weaker d-stack"
638,d-manifoldsd-manifold,"M-polyfoldd-manifold, d-manifold d-submanifold, d-manifold immersiond-manifold, d-manifoldd-manifold, d-manifolds d-manifold, d-manifoldsd-manifold, derived manifoldsd-manifold, dg-manifolds dg-manifold, manifold d-manifold, manifold manifold, manifoldd-manifold, manifoldsd-manifold, submanifolds manifold"
639,d-orbifold orientations,"curvesd-orbifold orientations, d-manifold orientation, d-manifold orientations, d-orbifold orientation, d-orbifold orientations, manifold orientation, orbifold orientationsorbifold, productsorbifold orientations, surfaced-manifold orientations"
640,d-space fibre,"d-space covered, d-space fibre, d-space fixed, d-stack fibre, discuss fibre, discussed fibre, fs-vp-h fs-rad, global fibre"
641,defining function,"Stetigen Funktionen, defining espaliers, defining function, defining functions, defining objects, defining particular, defining pencil, defining subpencil, fitting function, functiondefinable function, generating function, implicit function, positive function, refining relation"
642,degrees,"agrees, decades, decades ago, degrades, degree, degree ODE, degree PDEs, degrees, der Geer, diagrams, disagree, pion degrees"
643,denote,denote
644,denote,denote
645,details,"Details, PDE fails, detail, detailed, details, dynamics, pencils"
646,difference,"AIP Conference, Conference, Difference, difference, difference"", differences, differing, indifferent, influence, largest difference, q-difference"
647,explain,"FGA explained, emphasis, explain, explain briefly, explained, explains, explosive"
648,fibre productsorbifold,"fibre productsd-manifold, fibre productsd-orbifold, fibre productsmanifold, fibre productsorbifold"
649,finite-dimensional,"embedded n-dimensional, even-dimensional, finite dimensional, finite-dimensional, finite-dimensional real, infinite dimension, infinite-dimensional, locally finite-dimensional, odd-dimensional"
650,functorial behaviour,"bubbling behaviour, functorial behaviour, non-Hausdorff behaviour"
651,fundamental,"Fundamental, fundamental, provide fundamental"
652,gluing d-spaces,"Gluing d-spaces, Gluing d-stacks, constructing d-spaces, glued d-space, glued d-spaces, gluing d-spaces, gluing d-stacks, include d-spaces, initial d-spaces, ringed spaces, underlying d-spaces"
653,higher,"Bishop, Higher, Pieper, Whitehead, bigger, differ, high-Z, high-energy, higher, highest, highly, hitherto, neither, richer, together'"
654,irreducible representations,"irreducible representation, irreducible representations"
655,isomorphism classes,"homomorphism obtained, isomorphism class, isomorphism classes, isomorphism types, isomorphism types"""
656,larger,"Garnier, enlarge, harder, jagged, large"", largely, larger, largest, longer, quarter, target"
657,natural decomposition,"horizontal composition, inducing decompositions, natural decomposition, natural decompositions, orthogonal decomposition, vertical composition"
