,centroid,clusters
1331,function defined,"ThomasThom defines, Thurston defined, addition defined, function defined, function defining, functionally independent, functiondefinable, identities defines, relation defined"
1332,geometrycontinous,"geometriescontinous, geometry continuous, geometrycontinous, geometrycontinuous"
1333,geometrycontinous geometry,"geometriescontinous geometry, geometrycontinous geometry, geometrycontinuous geometries, reduciblecontinous geometry"
1334,infima,"Hiroshima, infima, infimum"
1335,injective hullinjective,"injective hullinjective, itsinjective hullinjective"
1336,itsinterval topology,"interval topology, itsinterval topology, theinterval topology, topologyinterval topology"
1337,measure theory,"Measure theory, measure theory, measure zero, structure theory"
1338,members,"Gambier, Membership, Memoirs, embeds, member, members, memory, numbers, remember, remembered, remembers"
1339,module-theoretic direct,"module-theoretic direct, module-theoretic statement, monoid-theoretical objects"
1340,monotone complete,"Functors compose, monotone complete, productsmonotone complete, terminology complete"
1341,multiple-free elements,"Multiple-free elements, multiple-free element, multiple-free elements"
1342,nonzero element,"largest element, nonzero direct, nonzero directlydirectly, nonzero element, nonzero elements, nonzero object, zero element"
1343,opposed,"imposed, opposed, opposite"
1344,positive measure,"families feature, positive measure, positive value, transitive closure"
1345,pre-espalier,"closureespalier, pre-espalier, pseudoscalar"
1346,refinement monoidsrefinement,"refinement monoidrefinement, refinement monoidsrefinement"
1347,ring continuous,"arbitrary continuous, defining Continuous, describing continuous, finite continuous, iijoin continuous, join-continuous, restrict continuous, ring continuous, tiny center-of-mass, underlying continuous, using continuous"
1348,section algebra,"quotient algebra, section algebra, section algebraAbzzglobs, section briefly, sectionally resp"
1349,total monoid,"total monoid, total monoids"
1350,GoBo Goodearl,"GoBo Goodearl, GoBo andGoodearl, GoBoGoodearl, GvnRR Goodearl, GvnRRGoodearl, ucsb edu/goodearl/"
1351,Monoid Monoid,"Monoid Monoid, MonoidMonoid, monoid monoid, monoid partial"
1352,Neumann's Coordinatization,Neumann's Coordinatization
1353,Nevertheless,"Nevertheless, nevertheless"
1354,algebra,algebra
1355,algebras,algebras
1356,algebras,algebras
1357,axiom system,"axiom system, axioms satisfied, bound systems"
1358,cancellativecancellative,"cancellablecancellable, cancellativecancellative"
1359,complements,"Acknowledgements, Acknowledgments, Implementing, complement, complemented, complements, implement, implemented, improvements, loop momentum, respects complements, taking complements"
1360,complete dimension,"Complete dimension, complete additivity, complete dimension, complete tensor, completely understood, comprehensive review, so-called dimension"
1361,completely elucidated,"Completely bounded, completely elucidated, completely elucidates, completely isolates, completely positive"
1362,elementsdirectly,"element isdirectly, elementsdirectly, elementsdirectly finite, finite elementsdirectly, refinement directly"
1363,embedding satisfying,"embedding Standing, embedding satisfies, embedding satisfying, equation satisfying, morphism satisfying"
1364,embedding theorem,"embedding defined, embedding theorem, embeddingsee Lemma, neglecting higher-order"
1365,espaliersespalier,espaliersespalier
1366,expression,"compression, expressing, expression, expressions, impressive, valued expression"
1367,finite subset,"coinitial subset, financial support, finite subset, finite subsets, finite suprema, finite-sizeLamb shift"
1368,identity map,"density exotic, identically zero, identity map, identity matrices, identity matrix, identity property"
1369,inVzzVB,"BVzzVB, CVzzVB, inVzzVB, ofVzzVB, withinVzzVB"
1370,indecomposable,"Indecomposability, countably decomposable, decomposable, indecomposability, indecomposable, indecomposable von"
1371,infinite structures,"finite structures, infinite structures, results---the structures, singularity structure"
1372,interpolation,"Interpolation, Interpolation"", extrapolation, iiinterpolation, incorporate two-pion, interiorinterior, interpolate, interpolation, interpolation group, interpretation, property iiinterpolation"
1373,lattice meet-continuous,"Complete meet-continuous, countably meet-continuous, lattice Scott-continuous, lattice continuous, lattice join-continuous, lattice meet-continuous"
1374,lattice ordered,"lattice cardinal, lattice chopped, lattice disjointness, lattice generated, lattice modular, lattice ordered, lattice-ordered, mit besonderer"
1375,lattice-ordered groups,"lattice-ordered group, lattice-ordered groups"
1376,lower interval,"closed interval, closed intervals, latter interacts, lower interval, lower subinterval, lowest integer"
1377,majorize,"factorizes, favorite, major theme, majorant, majority, majorize, majorized, majorizes, uniformize"
1378,majorized subset,"majorized sequence, majorized subset, majorized suprema"
1379,maximalantichain antichain,"antichainsantichain, densedenseantichain antichain, maximal antichainsantichain, maximalantichain antichain"
1380,monoidsrefinement monoid,"monoidrefinement monoid, monoidsrefinement monoid"
1381,ofAW,"IUAP, WAW, anAW, forAW, ofAW, ofW"
1382,ofpzzrojst,"Letpzzrojst, Spzzrojst, allpzzrojst, antichain ofpzzrojst, notation pzzrojst, ofpzzroj, ofpzzrojst, putpzzrojst, pzzrojst"
1383,ordered abelian,"Ordered Abelian, Readers familiar, nonzero abelian, ordered abelian, ordered monoids, ordinary cartesian, preordered abelian"
1384,ordered group,"Korteweg-de Vries, ordered group"
1385,outside,"Outline, outline, outside, tail outside"
1386,parallelogram,"parallel issue, parallel material, parallelogram, parallelogram rule, rule parallelogram"
1387,partial monoid,"natural monoid, partial binary, partial monoid, partial monoids, partial ones, partial submonoid, partial submonoids"
1388,perspectiveperspectivity perspectivity,"perspectiveperspectivity perspectivity, perspectivityperspectivity perspectivity"
1389,perspectivityperspectivity,"bi-perspectivity bi-perspectivity, hence perspectivityperspectivity, pairwise perspectiveperspectivity, perspectiveperspectivity, perspectivity perspectivity, perspectivityperspectivity"
1390,presented,"predicted, presence, presented, presently, presents, represented"
1391,projection lattices,"Projection lattices, function lattices, projection lattices, projection latticeslattice"
1392,random algebra,random algebra
1393,slightly,"Atiyah Atiy, Roughly, slight, slightly, slightly sharper, slightly underbound, tightly"
1394,topologyinterval,"interval topologyinterval, topology interval, topologyinterval"
1395,two-sided ideals,"Two-sided ideals, two-sided ideals, two-step iterated"
1396,type decomposition,"Direct decompositions, III decomposition, block decomposition, direct decompositions, obtain decompositions, type decomposition, type decompositions, unique decomposition"
1397,using Axiom,"obtain Axiom, remove Axiom, using Axiom, using Axioms, using Claim, using bordism, using fairly"
1398,vanishes outside,"vanish outside, vanishes outside, vanishes unless"
1399,Anwendungsgebiete,"Anwendungsgebiete, der Anwendungsgebiete"
1400,Archimedean lattice-ordered,"Archimedean lattice, Archimedean lattice-ordered, complete lattice-ordered"
1401,"Banach-Tarski Paradox""","Banach-Tarski Paradox"""
1402,Basic properties,"Basic properties, Local properties, analytic properties, atomic properties, basic properties, calculate properties, desired properties, local properties, standard properties, useful properties, various properties"
1403,Basically,"Basically, Basically WTC, Illusie Illu, basically, cyclically, occasionally, typically"
1404,Berlin-Heidelberg-New,"Berlin-Heidelberg-New, Berlin-Heidelberg-New York, York-Heidelberg-Berlin"
1405,Boolean espalierespalier,"Boolean espalierespalier, Boolean espaliersespalier, Boolean pre-espalierespalier"
1406,C-valued universeVzzVB,C-valued universeVzzVB
1407,Cantor-Bernstein,"Cantor-Bernstein, Cantor-Bernstein type"
1408,CorollaryclaimClaimsclaimClaim,"CorollaryclaimClaimsclaimClaim, lemma CorollaryclaimClaimsclaimClaim"
1409,Czzo,"BrzzB, Bzzo, CCtzzCCx, Caboz, Czzfin, Czzo, ErzzE, Mzzl, MzzodR, Nzzh, Ozzn, Rizzoli, SSzzDI, Uzz, bzzlo, czzca, czzhi, czzlo, kzzcdotA, mzzu, pzzbot, wzzdt"
1410,D-universalD-universal classes,"D-universalD-universal class, D-universalD-universal classes, D-universalD-universal relative, D-universalityD-universal problem"
1411,Definitionexample,"Definitionex thm, Definitionexample, Definitionexample lemma, Definitionlemma Lemma, Questionexample, definition involves, definitions assume, lemma Definitionexample, motivating example"
1412,Einzeldarstellungen,"Einzeldarstellungen, Einzeldarstellungen mit"
1413,ExampleproblemProblem,"ExampleproblemProblem, lemma ExampleproblemProblem"
1414,Francewehrung,"Francewehrung, Francewehrung math, Wehrung Wehrung, extended inWehrung, unicaen fr/wehrung"
1415,Furthermore,Furthermore
1416,Furthermore,Furthermore
1417,Furthermore,Furthermore
1418,Halperin Halperin,"Halp Halperin, Halperin Halperin, HalperinHalperin"
1419,JvNbookvon,"JvNbook, JvNbook von, JvNbookvon"
1420,Kaplansky developed,"Kaplansky developed, Kaplansky introduced, Kaplansky showed, approach developed"
1421,Neumann algebras,"Neumann Algebras"", Neumann algebra, Neumann algebras, Neumann geometries, effect algebras"
1422,NotationnoteNote,"NotationnoteNote, lemma NotationnoteNote"
1423,Princeton Univ,"Princeton Math, Princeton Univ, Princeton University, Princeton lecture"
1424,Propositioncorollary,"Propositioncor thm, Propositioncorollary, Propositioncorollary lemma, lemma Propositioncorollary, superposition formula"
1425,Remarknotation,"Remarknotation, Remarknotation lemma, d-stack notation, lemma Remarknotation"
1426,Scientific,Scientific
1427,Singapore,"Ringrose, Singapore"
1428,Stone spaceStone,"Stone spaceStone, Stone spacesStone"
1429,Suppose otherwise,"Suppose otherwise, suppose otherwise"
1430,Theoremproposition,"Theoremproposition, Theoremproposition lemma, lemma Theoremproposition, reformulate Proposition"
1431,Unique representation,"Consider representations, Riccati representation, Unique representation, affine representation, concrete representation, simple representation, unique representable"
1432,abstract measure,"Abstract measure, abstract measure, attractive picture, contexts---abstract measure"
1433,addition operation,"addition formula, addition operation, addition operations, additive notation"
1434,algebraic,algebraic
1435,algebras,algebras
1436,algebras,algebras
1437,algebras,algebras
1438,aller,"Agler, Euler, Fallieros, Floer, Fuller, Miller, Salle, Schauffler, Smaller, Walter, Weller, aller, alter, older, smaller"
1439,alp,"Ball, Halm, Halp, Klep, Wall, Walzl, abzzzlp, ago, aleph, alephs, alg, alp, alpha, auf, klep"
1440,alternative description,"alternative axiomatization, alternative description, alternative descriptions, alternative formulation, alternative presentation"
1441,anpzzroj,"Forpzzroj, Givenpzzroj, Lpzzroj, Spzzroj, Thenpzzroj, aboutpzzroj, allpzzroj, andpzzroj, anpzzroj, anypzzroj, apzzcdota, endow Spzzroj, forpzzroj, frompzzroj, iipzzroj, inpzzroj, mappzzroj, ontopzzroj, pzzroj, somepzzroj, thatpzzroj"
1442,arbitrary injective,"arbitrary function, arbitrary infima, arbitrary injective, arbitrary lattice, arbitrary objects, properties ofinjective"
1443,basic examples,"Central examples, Specific examples, basic concepts, basic example, basic examples, basic shape, classical examples, construct examples, exist examples, prefer examples, various examples"
1444,bundle,bundle
1445,bundle,bundle
1446,calculations,"Calculation, Calculation shows, Calculational, Calculations, QED calculations, calculating, calculation, calculation exists, calculational, calculations, calculations alpha, calculations using, cancellations, half-periods"
1447,cardinal algebras,"cardinal algebra, cardinal algebras, cardinal values, corona algebras, matrix algebras"
1448,category-theoretical,"category-theoretic, category-theoretical, category-theoretical notation"
1449,classes proper,"allowing proper, classes becomes, classes proper, makes proper"
1450,closed,closed
1451,closureclosure iiXzzclosure,closureclosure iiXzzclosure
1452,complementedrelatively,"complemented lattice, complementedrelatively, complementedsectionally"
1453,complementedsectionally complementedrelatively,complementedsectionally complementedrelatively
1454,complete,complete
1455,concept,"cancels, concept, concepts, concern"
1456,constant value,"compiled value, constant value, constant values, contains values"
1457,context---for instance,"context---for instance, purposes---for instance"
1458,continuous geometry,"Continuous Geometry, Forcontinous geometry, continuous geometries, continuous geometry, continuous geometry"", continuous regular, converges geometrically, ofcontinous geometry"
1459,crucial importance,"crucial importance, exceptional importance, particularly important, relative importance"
1460,current,"Barrett, Laurent, correct, current, current lack, current level, currentc-mec, currently, currents, incorrect"
1461,definable functiondefinable,definable functiondefinable
1462,define elements,"Define elements, define elements, define enumerative, define objects, denote elements, exist elements, hyperfine experiments, inductively elements, large"" elements, neutral elements, obtain elements"
1463,defined orthogonality,"Define orthogonality, canonical orthogonality, defined orthogonality, elementary orthogonality, standard orthogonality"
1464,definition underlying,"definition included, definition underlying"
1465,definitiondefinition,"definitionDefinition, definitiondefinition, definitiondefinition lemma"
1466,der Math,"Acta Math, Duke Math, III MacL, Lerm Metz, London Math, Manuscripta Math, Nagoya Math, Pure Math, der Math, der math"
1467,difficult result,"definitive result, difficult aspect, difficult problem, difficult result, difficult results, difficult technical"
1468,dimension functions,"Dimension functions, dimension function, dimension functions, measure functions"
1469,dimension monoid,"dimension monoid, dimension monoids, dimension theory"
1470,dimension-theoretic,"dimension-theoretic, dimension-theoretic results, dimension-theoretical, earlier dimension-theoretic"
1471,dimension-theoretical properties,dimension-theoretical properties
1472,direct generalization,"d-orbifold generalization, direct generalization, direct verification, drastic generalization, infinite generalizations, obvious generalization"
1473,distinguished,"distinguish, distinguished, distinguished zero, fitting worked"
1474,easily generalized,"easily generalized, material generalizes, so-called generalized, theory generalized"
1475,easy exercise,"analyze precise, easy exercise, easy exercises"
1476,element ofVzzofR,"element VzzofNSIR, element ofVzzofR, elements ofDzzrng, elements ofpzzroj, ideal ofVzzofR, order-unit inVzzofR, unit ofVzzofR"
1477,eliminated,"dominated, easily eliminated, eliminate, eliminated, elimination, elucidate, elucidated, elucidates, helium isotopes"
1478,encounter,"encounter, encountered"
1479,equal---before,"equal---before, equal---before forming"
1480,equipotency iiequipotency,equipotency iiequipotency
1481,equivalent,equivalent
1482,espalier espalier,espalier espalier
1483,espalier espalier,espalier espalier
1484,espalier espalier,espalier espalier
1485,espalierespalier,espalierespalier
1486,espalierespalier,espalierespalier
1487,espalierespalier,espalierespalier
1488,espalierespalier,espalierespalier
1489,espalierespalier Boolean,"espalierespalier Boolean, espalierespalier bounded, espalierespalier follows, espaliersespalier Boolean, pre-espalierespalier Boolean"
1490,espalierespalier arising,"espalierespalier andDzzrng, espalierespalier arising, espaliersespalier discussed, espaliersespalier obtained, espaliersespalier satisfying"
1491,espaliersespalier,espaliersespalier
1492,espaliersespalier,espaliersespalier
1493,exist,exist
1494,exists,exists
1495,fail,"Feil, Paul, Phil, fail, fails, fair, fairly, faithful, tail"
1496,finite ones,"finite follow, finite joins, finite meets, finite modules, finite ones, finite sets, finite sums, finiteness, inside loops, limit becomes, transfinite ones"
1497,fortunately,"Fortunately, analyses unfortunately, formulate concisely, fortunately, unfortunately"
1498,fundamental example,"fundamental basis, fundamental class, fundamental example, fundamental examples, fundamental principle, fundamental result"
1499,generated,generated
1500,generates,generates
1501,idempotent homomorphism,"idempotent homomorphism, idempotents isomorphic, monoid homomorphism, one-to-one homomorphism"
1502,iiRzzinfty,"Zzzinfty, class Zzzinfty, iiRzzinfty, iiTzzinfty"
1503,inVzzofNSIR,"VzzofNSIR, inVzzofNSIR, ofVzzofNSIR, thatVzzofNSIR"
1504,infinite orthogonal,"infinite orthogonal, maximal orthogonal, pairwise orthogonal, strongly orthogonal, uncountable orthogonal"
1505,initial ordinal,"arbitrary ordinal, coinitial coinitial, initial ordinal, initially obvious, limit ordinal"
1506,injective module,"essential submodule, infinite module, injective group, injective hulls, injective module, injective modules, injective modulesring, ofinjective hull, projective complex"
1507,interiorinterior iiXzzinterior,interiorinterior iiXzzinterior
1508,involutive anti-automorphismpzzroj,involutive anti-automorphismpzzroj
1509,involve forcing,"involve choosing, involve compact, involve forcing, involve forming, involve perturbing, iterated forcing"
1510,isomorphismpzzroj,"anti-automorphismpzzroj, isomorphic toVzzofR, isomorphism Zzzgamma, isomorphism fromDzzrng, isomorphism frompzzroj, isomorphismVzzofR, isomorphismpzzroj, isomorphismpzzroj SVzzofR"
1511,latter consists,"Carnevale consists, formulation consists, latter consists, paper considers, review consists, strict consists"
1512,lattice complete,"Dedekind complete, disjoint complete, fairly complete, handling complexities, iiDedekind complete, lattice complemented, lattice complete, lattice sectionally, latticelattice complete, suitable complete"
1513,lattice-theoretical definition,"Lattice-theoretical generalizations, lattice-theoretical definition, lattice-theoretical definitions, lattice-theoretical version"
1514,latticeslattice ofAW,"latticelattice modular, latticeslattice ofAW, latticeslattice sectionally"
1515,letpzzroj,"Letpzzroj, Putpzzroj, letpzzroj, letpzzrojst, putSzzbul, putXzzbot"
1516,longer sets,"Convex Sets, clopen sets, convex sets, longer sets, longer works, meager sets, momentum sets"
1517,majorized trim,"majorized finite, majorized trim"
1518,map,map
1519,map,map
1520,map,map
1521,map,map
1522,map,map
1523,map,map
1524,maximal quotient,"Maximal quotient, maximal quotient, typical wavelength"
1525,maximalantichain,"antichainantichain, maximal antichain, maximalantichain, maximalring maximal"
1526,missing,"main missing, missing, missing item, mixing, passing"
1527,modular latticelattice,"complete latticelattice, modular latticelattice, modular latticeslattice"
1528,monoid VzzofR,"Malanotte Rizzoli, monoid VzzofR, monoid Zzzgamma, monoidSzzRef, monoidVzzofR, monoiddzzimL, monoids Dzzrng, submonoid ofVzzofR"
1529,monoid introduced,"function introduced, monoid introduced, monoid produces, previously introduced, products introduced"
1530,natural numbers,"natural boundary, natural guess, natural numbers, natural types, rational numbers, real numbers, unnaturalness pervades"
1531,nontrivial direction,"non-trivial direction, nontrivial cancellation, nontrivial conditions, nontrivial direction, nontrivial homogeneous, reversing directions"
1532,nonzero projection,"generated projective, largest projection, nonzero location, nonzero projection, nonzero projections, nonzero projectionspzzroj, smallest projection"
1533,observe thatVzzofR,"Observe thatpzzroj, clear thatVzzofR, observe thatVzzofR"
1534,onVzzofR,"SVzzofR, SinceVzzofR, VzzofR, andVzzofR, caseVzzofR, eachVzzofR, inVzzofR, map onVzzofR, ofVzzofR, onVzzofR, someVzzofR, thatVzzofR, toVzzofR"
1535,orthogonal direct,"orthogonal direct, orthogonal directly, orthogonal projections, orthogonality property, orthogonality relation"
1536,parameter,"paradoxes, parameter, parameters, six-parameter, two-parameter"
1537,plan,"Gpoag, flat, plain, plan, plane, play, plus, polar"
1538,preliminary results,"Preliminary version, auxiliary results, preliminary calculations, preliminary lemmas, preliminary results"
1539,probably,"Broadly, probability, probably, probably wouldn't"
1540,procedure,"procedure, procedure adapted"
1541,projectionspzzroj,"conditionspzzroj, projectionpzzroj, projections Berberian, projections ofDzzrng, projectionspzzroj, provides anpzzroj"
1542,projective projectivity,"decomposition projectivity, notation perspectivity, projectionprojection, projective projectivity, projectivity projectivity, prove distributivity"
1543,proper direct,"preserves direct, productdirect, proper direct, proper treatment, propose direct, prove directly, proved directly, serious defect"
1544,pzzroj SDzzrng,"clear thatDzzrng, ofpzzroj SDzzrng, pzzroj SDzzrng, pzzroj SVzzofR"
1545,quotient ring,"questions arising, quotient ring, quotient ringring, quotient rings"
1546,range dimension,"fixed dimension, larger dimension, mixed dimension, monoiddimension, monoidsdimension, pure dimension, range dimension, rangedimension, rangesdimension, real codimension, smaller dimension"
1547,real extension,"Boolean extensions, generic extension, real dimension, real extension, unique extension, zero extension"
1548,reducible ones,"Reducible von, reducible Type, reducible ones, reduciblecontinous"
1549,refining unrestrictedly,"additive unrestrictedly, assigning uncertainties, refining unrestrictedly"
1550,relation holds,"Zealandigor klep, behaviour comes, claim holds, condition holds, notation helps, reflection shows, relation coincides, relation expressing, relation fails, relation holds, relationships, relative roles"
1551,replace countable,"accuracy achievable, replace countable, replacing countable"
1552,replacing isomorphism,"commuting isomorphisms, corresponding isomorphisms, espalier isomorphic, replace isomorphism, replacing isomorphism"
1553,represent,"lines represent, represent, represents"
1554,respectivement congruentes,respectivement congruentes
1555,result,result
1556,result,result
1557,result shows,"lemma shows, result follows, result gives, result holds, result involves, result makes, result shows, results allows, results shown, results similar"
1558,roles,"MPolFS, PolFS, Solel, holds, poles, poles"", role, roles, routes, rules, solely"
1559,scale follows,"latter follows, proof follows, readily follows, scale comes, scale follows, statement follows, static Coulomb, sufficiency follows"
1560,second-order,"coupled second-order, first-order, second-order"
1561,set-theoretical paradoxes,"set-theoretic difficulties, set-theoretical paradoxes, set-theoretical practice, set-theoretical terminology"
1562,sharper statement,"minimality statement, sharper statement, stronger statement, uniqueness statement"
1563,simultaneously,"families simultaneously, nucleons simultaneously, proves simultaneously, simultaneously, simultaneously polarize"
1564,stably finite,"finitestably finite, ifstably finite, stably finite, stably finitestably, suitable choice"
1565,structures satisfying,"structure satisfying, structures anyway---and, structures satisfying"
1566,subset,subset
1567,subset ofVzzofNSIR,"densedense inVzzofNSIR, satisfied inVzzofNSIR, subset ofVzzofNSIR"
1568,sum defining,"LMI defining, Semidefinite, axioms defining, minimal defining, semidefinite, sum defining, system defining, system engineering"
1569,trim sequence,"transfinite sequence, trim sequence, trim sequences"
1570,understood,"easily understood, poorly understoodMEC, understand, understood, understoodMEC, well-understood"
1571,undesirable set-theoretical,"undesirable set-theoretical, well-established set-theoretical"
1572,unique projections,"central projections, define projections, exist projections, infinite projections, unique projection, unique projections, unique solution"
1573,using Corollary,"strengthen Corollary, using Bohr-Sommerfeld, using Corollaire, using Corollary, whence Corollary"
1574,where---as above---we,where---as above---we
1575,write Dzzrnggf,"Hence Dzzrnggf, write Dzzrnggf, write MzzodR, writeabbtzzrim"
1576,nuclear physics,"Nonlinear physics, Nuclear Physics, Nuclear physics, Nuclear processes, light-nuclear physics, modest physics, nuclear electric, nuclear physicists, nuclear physics, nuclear physicshenry, nuclear physicspc, nuclear theorists, ocean physics, useful physics"
1577,results,results
1578,shift,"Phif, Schmidt, shift, shift helium, shift muonic, shiftLamb, shifts"
1579,polarizability,"Polarizability, polarizabilities, polarizability, polarizability Coulomb, polarizability tensor, polarizationVacuum, proton probability"
1580,radii,"Brasil, Pacific, aadzzi, radial, radii, radii wave, radius, ratio"
1581,measurements,"MeasurementsThe, measure moments, measureLebesgue, measured mean-square, measurement, measurement Nucleus, measurement tests, measurements, measurements provide"
1582,proton,"Arkatov, Hylton, Kyoto Univ, Proton, Thurston, photon, photons, proton, proton size, proton's, protons, protons', radii proton"
1583,nuclei,"Machleidt, Nuclei, Nucleon, nuclei, nucleon"
1584,exchange,"base change, easy changes, exchange, exchange binds, exchanged, exchanges, exchanging, unchanged"
1585,moments,"amounts, moment's, momenta, moments, moments adds, momentum"
1586,potential,"Potential, potential, potential inside, potential looks, potential term, potentials, pseudopotential"
