,centroid,clusters
0,free,"Drell, Free, Freese, Frem, Green, Street, agree, f'X', free, freely"
1,matrix,"Harry-Dym, Kavruk, Matrix, Parrilo, Ratiu, hadronic, material, matricial, matrix, motivic, msri, mutatis"
2,unitary,"FuOn FOOO, Hagiwara, Library, Putinar, Solitary, Unitary, anyway, auxiliary, binary, editors, entry, finitary, solitary, unicaen, unicaen frhttp, uniform, uniformly, unital, unitaries, unitarily, unitary, unitfinitary, unwieldy"
3,free circular,"Free Circular, free circular, free convexity"
4,linear,"Eitner, Hungar, LevineTabor, Linear, LlibreZhang, Pleinlaan, Shiner, anneaux, bilinear, linear, linearly"
5,theorem,"Chelsea, Reeb orbit, Shelyuto, Theorem, Theorem BVM, Theoremlem, Theorems, Todorov, basic theorem, checked, cor theorem, helium, main theorem, phenomena, theorem, theorem lemma, theorems, theories, theorist, theorists, theory doesn't, therein, third degree, type theorem, ythere"
6,exists,"MeV PDG, Weiss, bound exists, exercises, exhaustive lists, existed, existing, exists, exists anAW, exits, f'X' exists"
7,direct,"Direct, detect, direct, directed, iidirected"
8,equation,"Equation, equation, equation KPP, equation N/u-U, equations, equations DHH"
9,invariant,"Casson invariant, G-invariant, Invariant, Pandharipande, anyway---and, contravariant, covariant, friar lanl, gauge invariance, i-invariant, inKaplansky, invariance, invariant, invariant free, invariant per, invariants, invariants coincide, invariants using, type invariants, variant"
10,positive,"Cosgrove, Fix positive, Institute, Radiative, nonpositively, pointlike, polarize, pole-like, positive, positive cone, positive maps, positively, positivity, primitive"
11,denote,"Denote, Despite, Janowitz, Malanotte, Okamoto, Rendiconti, Rep Tot, Smooth, Yennie, adequate, brief note, deff obo, denote, denotes, denoting, dense, density, depth, devote, doesn't, encode, monotone, permute, remove, scale denote, smooth"
12,closed,"Alfred, Encyclopedia, Florida, Illusie, avoided, caused, chopped, clopen, closed, closed map, closely, closest, closure, cloud, confused, cos x-C, employed, factored, hoped, iiXzzclosure, knowledge, lose, loses, poset, slope, two-step, ucsd edu"
13,operator,"Ford Motor, Klep Igor, Laboratory, Moer MoPr, Operator, Operators"", charge operator, multi-operator, non-Hausdorff, operate, operator, operators, powerful tool, prey-predator, spin operator, thereafter"
14,conjugation,"Conjugation, combination, computation, computations, conjugacy, conjugate, conjugating, conjugation, conjunction, formulation"
15,Math,"GFMC-at, GFMC-h, HuTh, MacL, Maeda, Marx, Mat, Math, Matveev, McCarthy, Myths, Mzzh, Nth, PaTh, XIVth, j-th, match, math, maths, myth, path"
16,Proposition,"Gromov--Witten, Khriplovichd-nu, Proposition, Propositioncor, Propositions, Proton Size, Vezzosi Toen, apply Proposition, extend Proposition, proposition, proposition sets, purposesneutron, superposition, thm Propositioncor, using Proposition, using Propositions"
17,coordinate,"Coordinate, Gordon Drake, MoerdijkMoer, cardinality, cardinals, cobordism, coordinate, coordinates, subordinate"
18,respect,"aspect, reflect, reflects, repeat, research, respect, respects, select"
19,defining,"Defining, Henning, Nevanlinna, adjoining, assigning, beginning, debunking, debunking myths, definable, defining, defining tuples, definite, deriving, dividing, fixing, heartening, imagining, refining, remaining, utilizing, weak binding"
20,proof,"Birkhoff, Briot, Dixbook, Gordoa, Gross, Growth, Kourogi, Nijhoff, Proof, brief, cartoon, cproof, easy proof, openof, period, pions, poorly, program, proof, propose, root, scproof"
21,particular,"Particular, particular, particularly"
22,contains,"Longmans, certains, constraints, contain, contains, domains"
23,matrix,matrix
24,matrix convex,"Matrix Convex, Matrix Pencil, Matrix convexity, basic convex, material combines, matrix balanced, matrix convex, matrix convexEW, matrix convexity, matrix pencil"
25,minimal,"American, Krein-Milman, Tamizhmani, minimal, minimal LMI, minimality, minimizes, minimum, minimum value"
26,spectrahedra,"Spectrahedra, Spectrahedron, spectrahedra, spectrahedron"
27,unitary conjugation,"Private Communication, Unitary Conjugation, complex conjugation, contractive conjugation, unitary conjugation"
28,boundary,"Secondary, Xboundary, boundary, boundary', dbo dorb, quotedarcy"
29,sets,"Bethe, LMIs, Lett, Metz, Phys, Reus, Reyes, Sets, Texas, Texts, User's, Wietz, Xsets, Yset, answers, checks, cuts, des, eds, etc, fits, guess, helps, j-s, meets, myths, puts, s-s, selects, self, semi, set-up, sets, setup, site, splits, steps, stepsize, texts, useless, uses"
30,implies,"families, implies"
31,matrix,matrix
32,variables,"Borisoglebsky, Variables, Varieties, Yang-Mills, cabzzabplusb, free variable, free variables, multivariable, parallel, parallels, reliable, valuable, valuable gift, van Ritbergen, variable, variables, variablesingular, visible"
33,denote,denote
34,equivalence,"Equivalences, Fluid Mech, equipotency, equivalence, equivalencecategory, equivalences, equivalent affine, equivalent suffices, iiequipotency"
35,homogeneous,"homogeneity, homogeneous"
36,linear pencil,"Linear Control, Linear Matrix, Research Agency, linear mapping, linear matrix, linear operators, linear pencil, linear pencils, monic pencil, nonlinear special"
37,positive integers,"additive inverses, distinct integers, modified Korteweg-de, positive integer, positive integers"
38,sum,"Kus, Raum, kusm, ppm, sam, sub, sum, sums, supp, sur, sym"
39,tuple,"Rule, Wille, bluepurple, couple, cycle, double, doubly, g-tuple, g-tuples, judge, rule, shuffle, suppl, title, tuple, tuples"
40,vector,"New-York, Tiator, factor, unit vector, vect, vect vqcoh, vector, vectors, vqcoh"
41,McCullough,"FOOO ought, McCullough, McCullough Scott, McDuff McDu, Mochizuki Moch, Scott McCullough"
42,unit,"Atiy, Boiti, Breit, Council, Dubuc, Ext, FOOO, Funct, GvnRR, Int, JETP, KPTT, Kundu, Puzynin, Qnuc, Quot, Ruan's, Shalit, United, Univ, Unlike, Vinet, WDim, Whit, bit, breit, cit, cubic, input, insight, int, mit, muonic, omit, orbit, ought, output, real unit, u"""", u""', u'/u, u'/x, ucsb, ucsd, ugly, unit, units, unity, unlike, usyd, vdim, wouldn't"
43,column,"Coulomb, Dor-On, KolcknQCD, Ono FuOn, Volume, colimit, column, column maps, columns, confluent, j-th column, middle column, volume, volumes, zero column"
44,item,"Adem, Entem, Items, Udem, atom, einem, itWA, item, items, step"
45,prove,"Verhoeven, improve, improved, probe, prove, proved, proven, proves"
46,Write,"WXYZe, Weitz, Whitney, Whitney's, Write"
47,assumption,"Assumption, added assumption, assertion, assumption, assumptions, assumptions imply, convex assumption, extra assumption"
48,direct sum,"direct limit, direct sum, direct sums"
49,finite,"Alfinito, finite, finitely, infinite, infinity"
50,hence,"Agency, Hence, Ince, Pencil, hence, whence"
51,shows,"Stoks, Thomas, knows, pushouts, rows, showed, showing, shown, shows"
52,subset,"Bouquet, Brussel, Huber, Musette, Paulsen, main subset, orb sef, sense"", subjected, subscripts, subsequent, subset, subsetVzzofR, subsets, subsumes, suggest, suggests"
53,Finally,"Finally, Firstly, finally, penalty, signal flow"
54,Furthermore,"Fillmore Fillmore, Furthermore, furthermore, scale Furthermore"
55,Mathematics,"Gauthier-Villars, Matematica, Matematika, Mathematical, Mathematician, Mathematics, biomathematician, der mathematischen, mathematical, mathematics, mathematics Relation, mathematischen"
56,Section,"H-action, MSpec Top, Section, Sections, Skelton, mention, section, sections"
57,closed,closed
58,commutative,"Commutative, Noncommutative, commutative, commutativity, comparative, noncommutative, supercommutative"
59,denote,denote
60,dimension,"Dimension, Division, PaiLeconsRDG, codimension, dim vdim, dimension, dimension n-k, dimensionVzzofR, dimensional, dimensionfibre, dimensions, n-dimensional"
61,exists,exists
62,free spectrahedra,"Free Spectrahedra, Free Spectrahedron, Free spectrahedra, free spectrahedra, free spectrahedron, investigates spectrahedra"
63,inclusion,"Conclusion, Conclusions, Donaldson, Xinclusion, conclusion, inclusion, inclusion map, inclusions, sinclusion"
64,main,"David, Imagine, Main, domain, gain, imagine, m'/n', main, min, remain"
65,symmetric,"Symbolic, asymptotic, non-symmetric, symmetric, symmetry, symmetry explains, symmetry limit, symmetryChiral, synthetic"
66,whenever,"Caen Cedex, ChRu Moer, Whenever, whatever, whenever, where---as"
67,University,"Universiteit, University"
68,admissible,"accessible, admissible, admissible chain, divisible, maximal admissible"
69,circular free,"Circular Free, Circular Matrix, Circular Sets, circular analog, circular domains, circular free, circular matrix, circular subsets"
70,complete,"Complete, Complexe, Moerbeke, Tomforde, complete, completion, complex plane, complexity, comprise, concrete, incomplete"
71,complex,"Complex, cabozzplus, complex, coupled"
72,distinct,"distinct, distinct local, distinct&, distinct& local"
73,interior,"Anderson, Paderborn, USA friar, Winternitz, exterior, exterior power', iiXzzinterior, inFillmore, inherit, interact, interacts, interior, superior, top exterior"
74,maps,"Maps, maps, mass, ways"
75,proof,proof
76,reducing subspace,"invariant subspace, reducing subspace, reducing subspaces"
77,separation theorem,"Coordinatization Theorem, Definitionalg theorem, cancellation theorems, generalize Theorem, obstruction theories, obstruction theoryscheme, representation theorem, separation result, separation theorem"
78,sequence,"frequencies, frequency, sequence, sequences, sequential, subsequence, subsequences"
79,subspaces,"Ruijsenaars, auspices, d-subspaces, discrepancies, size cancels, subclasses, subespaliers, subsheaves, subspace, subspaces, sum makes, task splits"
80,version,"Gerasimov, VezzosiToen, inversion, version, versions"
81,Gleichstellensatz,"Gainesville sam, Gleichstellensatz, Positivstellensatz, convex Positivstellensatz, linear Gleichstellensatz"
82,analysis,"Analysis, abzzlesssim, analyses, analysis, analytic, analyticity, analytique, analyze, analyzed, analyzing, bianalytic"
83,compact,"Compact, coh qcoh, compact, impact, imply paracompact, paracompact"
84,countable,"countable, countable chain, countably, uncountable"
85,depending,"Depending, Extending, demanding, dependence, depending"
86,elements,"Elements, achievements, dipole moments, element, element lies, elements"
87,evaluations,"Evaluations, Grammaticos, Transactions, amalgamation, evaluate, evaluating, evaluating entrywise, evaluation, evaluation map, evaluation maps, evaluations, evaluations extend, evaluations produce, variations"
88,free matrix,"Alfred Tarski, Effros-Winkler matricial, Extremal matrix, Free matrix, closed matrix, column matrix, combine material, free basic, free matrix, implies matrix, monic matrix, shows matrix"
89,homogeneous linear,"homogeneous coordinates, homogeneous homogeneous, homogeneous linear, homogeneous operator, homogeneous sequence"
90,integer,"Krieger, Metzler, Nijmegen, Upmeier, integer, integer Fuchs, integers, intended"
91,multiplication,"Define multiplication, multiplication, multiplicity, recent application, scalar multiplication"
92,needed,"badly needed, needed"
93,operator pencil,"Operator Pencil, Operator Spaces, operation abzzzlp, operator convexity, operator defined, operator model, operator pencil, operator singular, operator topology, proper subpencil"
94,orthogonal,"Orthogonality, exist orthogonal, orthogonal, orthogonality, orthogonals, orthonormal, orthoseparable"
95,orthonormal basis,orthonormal basis
96,product,"by-product, coproduct, coproducts, predict, produce, produces, producing, product, product', productfibre, products, products', project"
97,proof,proof
98,proper,"Ker Coker, avoid proper, paper, proof appears, proper, proper map, properly, property, propertyM, proposed"
99,relatively,"PSI savely, Recursively, negatively, relatively, relatively crude, relatively weak, relativity, routinely"
100,result,"McNulty, gratefully, regular, resort, result"
101,self-adjoint,"denote self-adjoint, self-adjoint, self-supporting"
102,suppose,"Suppose, purpose, purposes, purposes---for, support, suppose, suppress"
103,term,"Amsterdam, BeXu, BeXu Lerm, Berb, Evert, Fermi, Geom, German, Gierz, Hearn, Lamm, Lem, Lerm, Lerman, Mem, Semi, Start, Steve, Thom, lem, mere, seem, t-u, term, terms, thm, throw, trim, try, turns, versa"
104,types,"Lopes, Popescu, Type, Type III, Types, cycles, hopes, six types, top Iso, type, types, types"""
105,unitary matrix,"functor' mapping, unitary matrices, unitary matrix, univariate matrix"
106,Appendix,"Addendum, Appendix, appendices, appendix"
107,Applying,"Analyzing, Applying, Assuming, applying, carrying, implying, upcoming"
108,Applying Lemma,"Apply Lemma, Applying Lemma, applying Lemma"
109,Corollary,"Corollaire, Corollaries, Corollary, Corollarydefi, Corollarylemma, CosPDEpara, corollary, corollary makes"
110,Polynomials,"Polar Duals, Polynomial, Polynomials, Polynomials fixed, monomials, polynomial, polynomials, term monomials"
111,argument,"Trofimenko, Vacuum Pol, agreement, apparent, arguing, argument, arguments, huge amount, segment"
112,canonical,"Calabi--Yau, Farenick, QEDChiral, San Diego, Vanhaecke, canonical, canonical copy, canonical image, canonical map, canonical maps, canonical shuffle, canonical shuffles, canonically, conical, conical conical, contains nontrivial, dynamical, fractalfractal, harmonic, non-canonical, non-unital, numerical, random real, subcanonical"
113,classification,"Classifications, Classifications based, Gambier classification, classification, classifications, classifications similar"
114,collection,"Bulletin, QED corrections, collaboration, collection, collects, correction, corrections, myth collection, reflection"
115,completes,"commuting letters, completes, complexes, complexes via, complexities, comprehensive, congruentes"
116,consequence,"confluence, consequence, consequences, consistency, convergence, easy consequence"
117,continuous,"Continuous, Contopoulos, Forcontinous, continues, continuous, continuum, iicontinuous, nonautonomous, ofcontinous"
118,definition,"Define addition, Definition, Definitionalg, Definitionex, Definitionlemma, Definitions, definition, definitions, definitive, determination, thm Definitionex, verification"
119,effective,"Effectively, Semieffective, affect precise, affects neither, effective, effective energy, effective-range, effectively, effectiveness, effects begin, noneffective, semi effective, semieffective"
120,fixed,"Dixmier, Fixed, Li-IS, Unified, WXYZd, aimed, edited, embed, field, fixed, fixed Chern, fixed loci, fixed tuple, fs-rad, fs-vp, funded, iVVd, mixed, rigid, sixth, ufl edu"
121,geometry,"Geometry, Geometry"", geometers, geometry, geometry aims, geometry"", geometry', isometry, supergeometry"
122,hypotheses,"hypotheses, hypothesis"
123,involution,"evolution, involution, involutionC, involutionLax, involutionLax pair, involutive, resolution, revolutionized"
124,irreducible,"Reducible, acts irreducibly, irreducibility, irreducible, irreducibly, reducible, trivial irreducible"
125,monic free,"convex free, monic free, monoid freely, muonic atoms, muonic hydrogen, nzzonethree"
126,norm,"Bori, Ford, Holm, Norm, dorb, norm, norms, synonym"
127,notation,"Notation, location, notation, notational, notational ease, notations, rotations"
128,observe,"Mislove, Observe, absence, absorbed, absorbs, abstruse, observables, observe, observed, observing, serve"
129,onto,"Alonso, Bobenko, Boston, Cantor, Compton, Cont, Conte, Control, CosScou, Exton, GoBo, Ingo, Johnson, Kont, Kyoto, London, Mono-, Monte, Motor, Ono, Oxto, Oxto Oxtoby, Oxtoby, Potts, Timo, Tokyo, bottom, fourth, hom dbo, ingo, motto, nonzero, obo, omXb, ones, ongoing, onto"
130,respectively,"respectively, respectivement"
131,results,"QCD results, Results, rests, results, results via, results---the, resultsiso, seagulls, theory Results"
132,satisfies,"justifies, satisfied, satisfies, satisfies Axiom, satisfies Claim, satisfies p-mKdV"
133,standard,"s`standard, standard, student David, t`standard"
134,subsection,"Subsection, Subsections, subsection, substantial, substitution, tocsectionIndex"
135,supported,"suggested, supp rank, supported, suspected"
136,system,"System, Systems, das System, subsystem, system, systematic, systemgood, systems, systems', systemsgood"
137,theory,"III theory, K-theory, Theor, Theory, Theory"", henry, j-th entry, theory, theory III, theory ZFC, theory"""
138,write,"Drake, Friar, G-orbits, Guide, Private, Service, Vrije, bridge, create, crude, friar, prime, trace, weighted, witness, write"
139,AMS,"A/t, AHH, AIP, AKNS, ALR, AMS, AMS/IP, ANL, Adv, Ann, App, Ara, Aut, B-A, B-C, BGC, BKW, BVM, CGApp, CNRS, D-H, DDSS, DHH, DMC, DMS, FGA, GFMC, H-D, HMW, Jb"", KKS, KPP, LMI, MEC, MMTa, MOS-SIAM, MSO, NATO, NATO Sci, NSF, PP"", QED, SIAM, UMR, USA, WTC, X-X, ZFC, j-A, k/S, kHz, kX/S, w-W, x-C, x-y"
140,Anal,"Acad, Akaho, Anal, Angel, Annali, Annals, Appl, Arnold, Atiyah, CEA--Saclay, Canad, Duals, SLa', Segal, Zal, analog, draw, dual, final, real"
141,Cambridge,"Cambridge, Cambridge Studies, Cambridge Tracts, Cambridge Univ, Tom Bridgeland"
142,Hilbert,"Eliashberg, Fillmore, Gibbons, Halburd, Halperin, Heidelberg, Hilbert, Holzwarth, Pickert, Reichert, Ritbergen, Weinberg, WeinbergQCD, d'Alembert, fixed Hilbert, iiabozzrthab, separable Hilbert"
143,Hilbert space,"Hilbert space, allowed space, tangent spaces"
144,Matrix Inequalities,"Matrix Inequalities, matrix inequality, quantum inequalities"
145,Similarly,"Similar methods, Similarly, familiarity, similarly"
146,Studies,"AMS/IP Studies, SIAM Studies, Stetigen, Studies, studied"
147,Using,"CRings, Fixing, Hsiung, Iso inc, Tsang, Uehling, Using, Using Hofer, escaping, lying, sinh, using"
148,affine,"Affine, affine, auf einem, fair affine, suffice"
149,algebra,"Algebra, California, Calogero, Oliveira, Santa Barbara, a'd'-b'c', algebra, algebra random, free algebra, subalgebra"
150,appear,"appear, appearance, appearing, appears, disappears, upper"
151,appropriate,"Myths propagate, appropriate, appropriate geometric, appropriate ingredients, appropriate notions, appropriate sizes, appropriate value, appropriate values, appropriately, appropriately sized, propagate"
152,bound,"Fund, QCD bound, amount, bound, bounded, sound, unbound"
153,characterize,"SchwarzianSchwarzian, characterize, characterize free, characterized, characterizes, characterizing"
154,choose,"Brooks/Cole, Choice, Choose, Choose unit, Ghaoui, Woodhouse, chaotic, choice, choices, choose, chooses, chose, dichotomy, impose, school"
155,class,"Alamos, CSchlfssc, Camassa, Classes, Eckhaus, Unless, class, class III, class', classes, classify, cross, flaws, plays, subclass, unless"
156,classical,"Classical, class map, classical, classical von"
157,completes,completes
158,complex variables,"Complex Variables, complete partially, complex Banach, complex Calabi--Yau, complex parameters, complex variables, heavier particles, matrix variables"
159,conclude,"conclude, concluded, concludes"
160,construction,"Kontsevich Kont, conservation, conservation laws, constant function, constructed inBoyle, constructing, constructing Boolean, construction, constructions, constructive, contraction, contractions, contractive, obstruction, obstructions, perfect obstruction, upcoming Section"
161,containing,"containing, forthcoming, nonvanishing, nuclei containing, obtaining, strengthening, worth noticing"
162,corresponding,"LMI corresponding, correspond exactly, correspondence, corresponding, radius corresponding"
163,cross term,"Ergebnisse der, Hiroshi Ohta, Zorn's Lemma, block zero, class theory, cross term, cross terms, crossratio, error term"
164,defined,"Dedekind, Define, Derived, FOOO define, Levine, MoPr defined, Moch defines, PDE defined, Pempinelli, Reprinted, decided, define, defined, defined WTC, defined type, defines, depicted, derived, designed, desired, divided, genuinely, iiDedekind, map defined, maps defined, undefined"
165,determined,"ball determined, determine, determined, determines, determines thedzzimL, determining, itA determines, pencil determined"
166,diagonal,"block superdiagonal, diagonal, diagonalized, diagram, superdiagonal"
167,direction,"Birk Birkhoff, Extraction, admit reductions, attention, bijection, bystczzonc, desired block, direct image, direction, directions, distortions, high-precision, prediction, zero section"
168,exist,"Bi-disk, Herbst, Lehigh, axis, exhibit, exist, extra"
169,existence,"Existence, essence, exist unique, existence"
170,extend,"Behrend, Bertrand, ExtonRM, Lorenz, Oxford, Zealand, exceed, excited, expendable, expense, extend, extend simply, extended, extends, extensive, extent, external, extremely"
171,free analysis,"Free analysis, free analog, free analysis, high-precision analysis, movable analytic, older analyses"
172,function,"Function, fonction, foundation, fraction, fractions, function, function"", functions, truncation, truncations"
173,grant,"Bjarni, Blatt, Braun, Dijkgraaf, Drach, Francis, Hamana, Krantz, NSF grant, Scand, Swart, Trans, Zhang, aren't, bordant, branch, drawn, glance, graded, gradient, grant, grant DMS, grants, graph, graphs, grasp, growth, meant, minorant, upgrade"
174,intersection,"Ringrose Kadison, bordism intersection, devote Section, entire section, finite intersection, integration, interaction, interactions, intersect, intersection, intersections, intersects, inverse methods, linear action, moment's reflection, plainthmTheorem section"
175,lemma,"Kleiman, Lemma, Lemmas, Lemmasublemma, Summa, Umemura, lemma, lemma makes, lemma sums, lemmaLemma, lemmas, via Lemma"
176,lies,"Diego, Dienst, Diff, Eides, Figs, Lie, Lin's, Riehs, Vries, Wills, aims, divides, gives, glue, goes, i-s, labels, laws, les, lie, lies, lifts, likely, lines, lives, loops, loss, realizes, widest, wishes"
177,linear functional,"Linear Functionals, linear functional, multi-operator functional, relatively irrational"
178,main results,"Basic results, Main Results, Using results, basic result, contains results, final result, main feature, main message, main milestones, main result, main results, main routes, major results, shading represents, various results"
179,matrix,matrix
180,matrix,matrix
181,maximal,"Maximal, capitals, maximal, maximality, maximalring, maximum"
182,natural,"Maharam, Manabu Akaho, Martorell, natural, natural map, naturally, ofMurray, seem unnatural, unnatural, unnaturalness"
183,neighborhood,"free neighborhood, neighborhood, neighborhoods, neighbourhood, neighbourhoods, neighbourhoods'"
184,noncommuting,"freely noncommuting, non-commuting, noncommuting, noncommuting letters"
185,note,"Bohr, Borel, Boyd, Boyle, Comp, Joe, Joyce, MoPr, Note, Notes, Ono FOOO, Pope, Scott, Tot, box', dotted, dozen, late, n'nx, nQCD, nice, none, nose, note, noted, notes, route, tome"
186,obtain,"Artin, BVM obtain, Edidin, Log sinh, OPEP tail, Szzfin, easily obtain, obtain, obtainable, obtains, ocean, retain"
187,polynomials invariant,"Polynomial evaluations, Rotationally invariant, polynomial depending, polynomials characterizes, polynomials invariant, polynomials positive, topological invariants"
188,preliminary,"Preliminary, lemmas preliminary, preliminary"
189,preprint,preprint
190,recent,"Invent, decent, descent, fairly recent, percent, receive, recent, recently, remedy"
191,replacing,"Neglecting, enlarging, group acting, klep auckland, neglecting, replacing"
192,representation,"LMI representation, Representations, degree birational, implementations, local representations, main implementations, orthocomplementation, prerequisite notion, presentation, presentations, preservation, representable, representation, representation theory, representations, representative, representatives, subrepresentation, subrepresentations"
193,restriction,"Restricting, real restriction, restriction, restriction imposed, restriction mappzzroj, restrictions, restrictive, restrictive class, retractions, unrestrictedly"
194,section contains,"measure contains, section contains, section summarizes, sectionsBanach, solution containing, subsection contains"
195,spaces,"D-spaces, Japanese, Spaces, d-spaces, espaces, patches, sheaves, space, space due, spaceStone, spaces, spaces using, spaces"", spaces', spacesStone, spacings, typefaces"
196,spectrum,"Epelbaum, spectral, spectrum"
197,stated,"Adapted, Eda Eda, Sta DMC, StaObs, adapted, iterated, located, restated, same', saturated, settled, shaded, shape, sharpened, sketched, slanted, spanned, stage, stand, stat, stated, static, status, stymied, traced, unabated, usyd edu"
198,subset,subset
199,subset,subset
200,symmetric monic,"Symbolic Logic, antisymmetric mzzonesix, isometric matrix, summaryDominic, symmetric group, symmetric linear, symmetric matrices, symmetric monic, symmetric operator"
201,tends,"Bernau's, Dennis, Etendues, Green's, Kenji, Leida, binds, ends, finds, genus, intends, kinds, mutandis, needs, sends, stands, tasks, tells, tends, tenth, thanks, tools"
202,univariate polynomials,"Invariant Polynomials, admissible polynomials, univariate polynomials"
203,various,"Darboux, Karplus, Various, vacuous, various, via torus"
204,written,"forgotten, rewritten, written"
205,yields,"Field, Lemma yields, fields, sides yields, yield, yield weak, yields"
206,Advanced,"Advanced, Advanced Books, Advanced Theory"", Advances, balanced"
207,Advanced Mathematics,"Advanced Lectures, Advanced Mathematics, Applied Mathematics, Brooks/Cole Mathematics, applied mathematics"
208,Algorithmremark,"Algorithmremark, Algorithmremark theorem, algorithm providing, theorem Algorithmremark"
209,Cambridge University,"Cambridge University, Hiroshima University, Lehigh University, Oxford University, Vrije Universiteit"
210,Conjecturequestion,"Conjecturequestion, Conjecturequestion theorem, theorem Conjecturequestion"
211,Conversely,"Conversely, conversely"
