,centroid,clusters
872,Manc category,"Basic category, CRings category, CSch category, Manb category, Manc category, Manc' category, objectcategory"
873,Orb',"BOrbFS, Ib', Jb', Obj, Obs, Orb, Orb"", Orb', Orbb, Orbc, Orbc', dOrb, dOrb', dOrbb, dOrbc, dOrbc', orb"
874,PiGaXd,"OGaXb, OGaXd, PiGaXa, PiGaXb, PiGaXc, PiGaXd, Picard"
875,Remarkfiguresectionequationsection,"Remarkfiguresectionequationsection, Remarkfiguresectionequationsection dim, thm Remarkfiguresectionequationsection"
876,SVEsa,"SVEsa, SVEsb, SVEsc, SVEsd, SVEse, SVEsf"
877,Satake--Thurston definitions,Satake--Thurston definitions
878,Sfb,"NXb, Sch, Sci, Sfa, Sfb, Sfc, Sfd, Sffb, Sffc, Sffd, Sffe, Sfff, SkX, Tfa, Tfb, dfXb, eff, hfs, sf-, ufl, wfn"
879,XGaa,"OGaXa, XGaa, XGab, XGac, XGad, XGae, XGaf, XGag, XGah, XGai, XGaj, jXGaa, jXGab, jXGac"
880,additional condition,"additional assumptions, additional condition, additional constraint, additional no-log, additional restriction, conditionno-logarithm condition, irreducibility condition, transcendental condition"
881,affine schemes,"affine linear, affine scheme, affine schemes, defines sheaves, ordinary schemes"
882,algebra,algebra
883,algebraic,algebraic
884,algebraic geometryderived,"algebraic geometry'derived, algebraic geometryderived"
885,algebraic-topological,"Algebraic topology, algebraic-topological, algebraic-topological information, nontrivial algebraic-topological, underlying topological"
886,algebras,algebras
887,alternative theories,"alternative choices, alternative forms, alternative theories, alternative theory, extensive series"
888,analogous result,"analogous nuclear, analogous result, analogous results, autonomous discrete, well-known result"
889,and/or sf-embeddings,"and/or embeddings, and/or sf-embeddings, exist sf-embeddings"
890,applied,"Applied, Applied Math, applicata, applied, applies, labelled"
891,applying Theorem,"applying Theorem, plainthmTheorem"
892,arise,"Borisov, Zariski, abrzzem, abuse, advised, argue, arise, arises, article, average, rise"
893,associativity properties,"associated projection, associativity properties, associativity property, associativity relations"
894,author wants,"author believes, author chose, author expects, author intends, author knows, author tried, author wants, author's treatment, method fails, pushforwards"
895,base,"Basel, Davey, Faber, Lebesgue, Page, Pashaev, awe, babrszzem, ball, base, based, behave, blue, cases, dashed, ease, easier, else, false, fast, phase, task, wave"
896,begin,"Abelian, Belgian, Medina, abelian, begin, begins, region, regions, type begin"
897,bordism bordism,"bordism bordism, bordism groupsbordism, bordismbordism, strata bordism, stratabordism"
898,bordism invariants,"Donaldson invariants, bordism invariant, bordism invariants, matrix invariants"
899,boundary dMan',"Reinhardt domains, boundary Manc, boundary behave, boundary dMan', boundary dOrb', boundary defined, boundary defining, boundary exist, boundary marked"
900,build,"briefly, build, built, mild, wild"
901,bundle,bundle
902,bundle morphism,"bundle morphism, bundle morphisms, etale morphism, induced morphism, pullback morphism"
903,bundle virtual,"bundle virtual, bundlesvirtual, bundlevirtual, involve virtual"
904,c-transversality b-transversality,c-transversality b-transversality
905,candidate,"candidate, candidates"
906,categorycategory,"categoriescategory, categoriescategory limit, category theory, category---a category, categorycategory, categorycategory opposite, categoryderived category, categoryhomotopy, categoryhomotopy category, fullcategory subcategory, opposite categorycategory, subcategorycategory"
907,central,"Central, Vedantham, central, chiral, control, covercentral, decent final, entirely, neutral, smaller central"
908,chain'virtual chain,"chain'virtual chain, chainvirtual chain"
909,choosing,"Choosing, Gnonsing, checked using, checking, choosing"
910,classvirtual,"class Virtual, class mapsvirtual, class'virtual, classesvirtual, classvirtual, mapsvirtual"
911,classvirtual class,"class'virtual class, classesvirtual class, classvirtual class, mapsvirtual class, spacevirtual class"
912,closed d-subspace,"closed d-subspace, closed d-substack, closed geodesics, closed subspace, fixed d-subspace, fixed d-subspaces, proper subspace"
913,closed subset,"balanced subset, bounded subset, clopen subset, clopen subsets, closed subobject, closed subobjects, closed subset, closed two-sided, closureclosure, compact subset, convex subset, fixed subset"
914,combined,"combine, combined, combines, compiled, recommended"
915,comment,"Commun, coherent, comment, comments, commodity, commonly, community, recommend"
916,complete description,"complete calculation, complete description, simple description"
917,completeness,"Completeness, assume completeness, compactness, completeness, complex numbers, monoid Completeness"
918,complex algebraic,"complex algebraic, convex algebraic"
919,conditionsvirtual,"coefficients equal, conditions/extra, conditions/extra data, conditionsvirtual, conditionsvirtual vector, local conditionsvirtual"
920,cone,"Argonne, Hone, Stone, cone, cone', cones, copy, core, corona, ions, m'ne, scope"
921,consider d-spaces,"consider d-spaces, consider d-stacks, considered d-space, considered fixed, considers diagrams, considers immersed"
922,considerably,"added considerably, considerable, considerable current, considerably, consideration"
923,constructions remain,"construction presented, constructions involving, constructions naturally, constructions remain, corrections begin"
924,continuous maps,"continuous map, continuous maps, continuous ring, continuous scales, nonautonomous ones"
925,contributions,"contribution, contributions, contributions arise, contributions scale, size contributions"
926,corner functorsd-manifold,"corner functorsd-manifold, corner functorsd-orbifold, corner functorsmanifold"
927,corners admits,"corners admits, corners applies, corners gluing, corners quotients, corners smooth, monoid admits, subset admits"
928,corners embeddingorbifold,"corners embeddingorbifold, corners s-embeddingorbifold"
929,corners manifold,"Northern California, corners Manifolds, corners d-manifold, corners d-submanifold, corners manifold, corners seemanifold, corners submanifold, cornersd-manifold, cornersmanifold"
930,corners structures,"corner structures, corners structures, ordered structures, partial structures, various structures"
931,corners throughout,"corners throughout, encounter throughout, product throughout"
932,corners w-submersiond-manifold,"corners immersiond-manifold, corners w-submersiond-manifold, corners w-submersiond-orbifold"
933,corresponding notions,"corresponding compositions, corresponding deuteron, corresponding morphism, corresponding notions, corresponding uniqueness"
934,corresponding scheme,"coherent sheavesC-scheme, corresponding class, corresponding eigenspace, corresponding fibre, corresponding lower, corresponding result, corresponding scheme, corresponding sheaf, volume pinsaDiscrete"
935,cotangent sheafDeligne--Mumford,"cotangent sheafDeligne--Mumford, cotangent sheavesDeligne--Mumford, structure sheafDeligne--Mumford"
936,counterpart,"Lamb-shift counterpart, counterpart, counterpoint, discrete counterpart"
937,counting,"Curve counting, Rodning, changing, counting, counting rates, counting via, countingPower, coupling, coupling spin, coverings, diophantine, focussing, pointing, routine"
938,criteria,"Criteria, criteria, criterion, useful criteria"
939,d-manifold etale,"Yd-manifold etale, d-manifold analogue, d-manifold etale, d-manifold example, d-manifolds replaces, d-orbifold etale"
940,d-manifoldsd-manifold orientations,"d-manifoldd-manifold principal, d-manifoldsd-manifold orientations, d-orbifoldsd-orbifold orientations, orientationd-manifold orientations"
941,d-manifoldsprincipal,"d-manifold principal, d-manifoldsprincipal, d-orbifold principal, manifoldsprincipal, orbifoldsprincipal"
942,d-orbifold bordismd-orbifold,"bordismd-orbifold bordismd-orbifold, d-orbifold bordismbordism, d-orbifold bordismd-orbifold, orbifoldsbordism orbifold"
943,d-orbifold equivalence,"d-manifold equivalence, d-orbifold equivalence, d-orbifolds equivalent"
944,d-orbifold virtual,"bundled-orbifold virtual, d-manifold virtual, d-orbifold virtual, d-orbifolds instead, dimensiond-orbifold virtual, manifoldvirtual, withd-orbifold virtual"
945,d-orbifoldsd-orbifold semieffective,"d-orbifoldsd-orbifold semieffective, d-orbifoldsd-orbifold semieffectived-orbifold"
946,d-orbifoldsd-orbifold virtual,"d-manifoldsd-manifold virtual, d-orbifoldd-orbifold principal, d-orbifoldsd-orbifold bordism, d-orbifoldsd-orbifold definition, d-orbifoldsd-orbifold local, d-orbifoldsd-orbifold virtual, d-orbifoldsorbifold strata, d-transversed-manifold virtual"
947,d-orbifoldsd-stack,"d-orbifoldsd-stack, d-orbifoldsstack, orbifold d-stack, quotient d-orbifoldsd-stack"
948,d-stack analogue,"atomic analogue, d-space analogue, d-stack analogue, d-stack analogues, d-stack etale, direct analogue, discrete analogue"
949,d-stack quotients,"C-stack quotient, d-stack quotients, system quotients"
950,d-stack virtual,"d-space virtual, d-stack version, d-stack virtual, sheafd-stack virtual"
951,d-stacksd-stack quotients,"d-orbifoldsd-stack quotients, d-spacesd-stack quotients, d-stackd-stack quotients, d-stacksd-stack definition, d-stacksd-stack orbifold, d-stacksd-stack quotients"
952,dSpac,"MSpec, Obj Spec, Spec, dSpa, dSpa"", dSpa', dSpab, dSpac, dSpac', dSta', dStab, dStac"
953,dXc boundary,"Choquet boundary, dXb boundary, dXc boundary, dXd boundary, local boundary, model boundary, products boundary, space boundary"
954,decompose,"Decompose, compose, decompose, decomposed, decomposes, decomposing, encompass, recognize, strata decompose"
955,define quotient,"define inductively, define quotient, defined quotient, defining quotient"
956,define six,"Define maps, Define scalar, define fibre, define six, define weak, defined inside, defined using, defines fixed, defines strict, gives six"
957,denote,denote
958,derived analogue,"Weaker analogues, complicated analogue, derived analogue, prove analogues"
959,derived scheme,"derived moduli, derived scheme, derived schemes, derived schemesderived, derived spaces, reviewed elsewhere, schemesderived scheme"
960,described locally,"described entirely, described locally, described wholly, determined locally, necessarily locally"
961,descriptions,"Descriptions, description, descriptions"
962,detailed summary,"detailed boundary, detailed formulae, detailed summary, detailed summaryDominic"
963,determined essentially,"determined essentially, determined phenomenologically, determined uniquely"
964,developed,"develop, developed, developed beginning, developed prior, developing, development, developments, envelope, unexplored"
965,diagram commutes,"U-modules commutes, diagram commute, diagram commutes"
966,differential-geometric spaces,"differential-geometric analogues, differential-geometric context, differential-geometric data, differential-geometric operations, differential-geometric picture, differential-geometric spaces"
967,dimensiond-manifold,"dimension d-manifold, dimensiond-manifold, dimensiond-orbifold, dimensiondimension, immersiond-manifold, n-dimensional submanifold, s-immersiond-manifold, sf-immersiond-manifold, submersionsmanifold, virtual dimensiond-manifold"
968,discuss orientations,"discuss conditions, discuss orientations, discussed orientations, discusses orientations, include orientations"
969,discussed d-transversality,"discussed d-transversality, discussed transversality"
970,effect,"DefXbot, Effect, affect, affects, defect, eff deff, effect, effects, effort, object, perfect"
971,elementary representation,"effective representation, elementary differential, elementary identities, elementary representation, elementary self-contained, elements represent, parametric representation"
972,elliptic equation,"Riccati equation, elliptic equation, elliptic equations, elliptic equationselliptic, elliptic function, elliptic solution, elliptic stepsize, evolution equations"
973,embedded d-suborbifold,"closed d-suborbifolds, embedded d-submanifold, embedded d-suborbifold, immersed d-suborbifold, w-embedded d-suborbifold, w-immersed d-suborbifold"
974,embedding d-manifold,"Embedding d-manifolds, embedding d-manifold, embedding obtained, embeddings manifold, embeddingsd-manifold, embeddingsee Definition, embeddingsmanifold, interesting d-manifolds, sf-embedding d-manifold, sf-embeddings d-manifold, underlying d-manifolds"
975,embeddingd-orbifold,"Embedding arbitrary, Embedding d-orbifolds, embeddingd-orbifold, embeddingorbifold, embeddingsd-orbifold, s-embeddingorbifold, sf-embedding orbifold"
976,embeddingd-orbifold embedding,"effectived-orbifold perturbing, embeddingd-orbifold embedding, embeddingorbifold embedding"
977,equationselliptic equationsmoduli,equationselliptic equationsmoduli
978,equivalencesd-orbifold equivalence,"equivalenced-orbifold equivalence, equivalencesd-manifold equivalence, equivalencesd-orbifold equivalence"
979,equivalencesd-space,"Equivalencesd-space, equivalenced-space, equivalenced-space gluing, equivalences d-stack, equivalencesd-space, equivalencesd-stack, equivalencesnormal"
980,equivalencesd-stack equivalence,"Equivalencesd-space equivalenced-space, equivalencecategory equivalence, equivalencesd-stack equivalence, equivalencesnormal equivalence, orientation-preserving equivalence"
981,equivalent,equivalent
982,equivalent,equivalent
983,equivalent definitions,"equivalent characterizations, equivalent definitions, fundamental definition, nonequivalent definitions"
984,example shows,"example Birkhoff, example Fukaya, example Wehrung, example provides, example shows, examples define, examples---see"
985,explicit fibre,"explicit closed, explicit d-space, explicit fibre, explicit formula, explicit global, explicit models, explicit writing, explicitly build"
986,extra data,"Ozawa Ozawa, Satake Sata, atomic data, dSta dSpa, deuterium data, extra data, extra terms, input data"
987,fairDeligne--Mumford,"Deligne--Mumford, fair Deligne--Mumford, fairDeligne--Mumford, groupsDeligne--Mumford, locally fairDeligne--Mumford, pullbackDeligne--Mumford, rankDeligne--Mumford, sheafDeligne--Mumford, stackDeligne--Mumford"
988,finite-dimensional vector,"finite-dimensional vector, infinite-dimensional vector"
989,flat maps,"class maps, flat map, flat maps"
990,forming moduli,"C-ring module, cyclic module, forming moduli, involving moduli, polynomial moduli, using moduli"
991,freedom,"Fredholm, extra freedom, freedom"
992,functional-analytic,"Functional analysis, coefficients analytic, functional calculus, functional-analytic, functional-analytic problem"
993,functor faithful,"faithfulfunctor faithfulcategory, fullfunctor faithful, functor faithful, functor natural"
994,functorcategory,"fullfunctor fullcategory, functorcategory, functorfunctorcategory, functorscategory"
995,functorcategory functor,"faithfulcategory functor, fullcategory functor, functorcategory functor, functorfunctor fullfunctor, functorfunctorcategory functor, functorscategory functor, pushoutpushoutcategory pushout, subcategorycategory subcategory"
996,functorial d-space,"functorial d-space, functorial d-stack, functorsd-space"
997,functororbifold,"functor'orbifold, functorialorbifold, functororbifold, functororbifold vector, functorsd-manifold, functorsd-orbifold, functorsmanifold, space functor'orbifold, space functororbifold"
998,generates,"Agency grants, WTC generates, Weierstrass, demonstrates, energies, generates, generates lengthy, generators, nongeneric cases"
999,generic perturbations,"generic perturbation, generic perturbations, transverse perturbations"
1000,geometric construction,"Deformation-obstruction, algebraic constructions, geometric construction, geometric constructions, geometry constructed, isometric conjugation"
1001,geometry derived,"Geometry Seminar, geometry derived, geometry designed, geometry extend, geometry extends, geometry focussed, geometry involve, geometry works, geometry'derived, geometryderived"
1002,geometryderived algebraic,"geometry'derived algebraic, geometryderived algebraic"
1003,global sections,"Coulomb corrections, encompass Subsections, global elements, global overview, global section, global sections"
1004,gluing profile,"gluing profile, gluing profilegluing, gluing profiles, recurring problem, splittings provide"
1005,groupC-stack,"ground-state, groupC-stack, groupsC-stack"
1006,groupoidgroupoidcategory,"groupoidgroupoidcategory, groupoidgroupoidcategory groupoid"
1007,harmonic maps,"Periodic Maps, bianalytic mappings, hadronic vacuum, harmonic maps, harmonic mapsharmonic, mapsharmonic mapsmoduli"
1008,homological algebra,"Homotopical Algebraic, categorical algebra, homological algebra"
1009,homology class,"cohomology Fukaya, homology class, homology classes, homology contact, homology group, homology groups, homology'Kuranishi, homologybordism, phenomenologyNuclear"
1010,homotopy theory,"broken-symmetry theory, homology theories, homology theory, homotopy category, homotopy categoryhomotopy, homotopy theory, rigorous theory"
1011,http,"Xtop, eduhttp, frhttp, http"
1012,iXa,"CiKa, LXIV, LXVI, NXa, b-a, c-a, dXa, dfXa, i-a, iVVa, iXa, iXb, iXc, iXd, isLam, omXa, psa, qua"
1013,image sheaves,"Heavy shaded, associated sheaves, discuss sheaves, image sheaf, image sheaves, study sheaves"
1014,immersionorbifold immersion,"immersiond-orbifold immersion, immersionorbifold immersion, submersionorbifold submersion"
1015,important areas,"emerging areas, important areas, important class, important component, important example, important geometric, important information, important measurements, important particular, important properties, important role, important structural"
1016,include d-orbifoldsd-orbifold,"effective d-orbifoldsd-orbifold, include d-manifoldsd-manifold, include d-orbifoldsd-orbifold, principal d-orbifoldd-orbifold"
1017,include extra,"impose extra, include Donaldson, include extra, include non-Hausdorff, include signs, includes extra"
1018,includes,"excludes, include, included, includes"
1019,including orbifolds,"Concluding remarks, include manifolds, including d-manifolds, including d-orbifolds, including orbifolds, including sheaf-like, including three-nucleon, involving d-orbifolds"
1020,indicates,"entry indicates, increases, indicate, indicated, indicates, indicates excited"
1021,infinite rank,"infinite VzzofR, infinite joins, infinite purely, infinite rank, infinite values, infinitesimal"
1022,information needed,"information bordism, information contained, information needed, information obtainable, information required, uniformization procedure"
1023,interesting properties,"elementary properties, integrality properties, interesting properties"
1024,interpreted,"incorporate, interpret, interpretable, interpreted, interpreting"
1025,intrinsic,"integer indices, intrinsic, intrinsic accuracy, intrinsic charge, intrinsic normal, intrinsic size, intrinsically"
1026,introduced,"introduce, introduced, introduces, reproduced"
1027,invariants Donaldson--Thomas,"cohomology Donaldson--Thomas, invariants Donaldson--Thomas, invariantsDonaldson--Thomas, invariantsDonaldson--Thomas invariants"
1028,investigate,"article investigates, heavily investigated, inverse image, invertible, investigate, investigated, investigates"
1029,isolated,"advocated, isolate, isolated, isolates, isolating"
1030,isomorphismfunctor,"holomorphic functions, isomorphic functors, isomorphically onto, isomorphism truncation, isomorphismcategory, isomorphismcategory functor, isomorphismfunctor, isomorphismfunctor natural, isomorphisms identify"
1031,join,"iijoin, join, joined, joins, nlin"
1032,lead,"Grad, Reid, lead, leads, learn, led"
1033,lifts naturally,"Orbifolds naturally, arising naturally, lift naturally, lifts naturally, looks unnatural, manifold naturally, theorists actually, various natural"
1034,limits exist,"colimit exists, limits exist, systems exist"
1035,list,"Polish, Syst, Vist, Vistoli, disc, gift, lest, lift, list, listed, lists"
1036,locally homeomorphic,"Global holomorphic, locally homeomorphic, locally isomorphic, naturally homeomorphic, prestable holomorphic"
1037,manifold bordism,"D-manifold bordism, d-manifold bordism, manifold bordism, manifoldsbordism, manifoldsbordism classical"
1038,manifoldsprincipal d-manifold,"d-manifoldsprincipal d-manifold, manifoldsprincipal d-manifold, orbifoldsprincipal d-orbifold"
1039,map,map
1040,map,map
1041,mixed rank,"masses vanish, mixed rank"
1042,morphisms pairs,"morphismd-space, morphisms pairs, morphisms reversed, morphisms smooth, morphisms using, morphismscategory"
1043,morphismshomologybordism,"define projectionshomologybordism, group morphismshomologybordism, homology homologybordism, morphismscategory morphism, morphismshomologybordism, projectionshomologybordism"
1044,morphismshomologybordism projection,"homologybordism projection, morphismshomologybordism projection, projectionshomologybordism projection"
1045,natural notion,"natural Boolean, natural Riccati, natural action, natural addition, natural bijection, natural bilinear, natural choice, natural continuous, natural extension, natural inclusion, natural notion, natural projection, natural settings, natural splitting, natural total, natural-looking, orbital motion"
1046,natural transformation,"Darboux transformations, natural stratification, natural transformation, natural transformationcategory, natural transformationfunctor, natural transformations"
1047,necessarily,"necessarily, necessarily unique, necessity, unnecessary"
1048,noetherian schemes,"noetherian schemes, non-noetherian schemes"
1049,nonlinear,"Nonlinear, Nonlinear Math, Nonlinearity, monic linear, nonlinear, nonlinear PDE, nonlinear item, nonlinearly, smooth nonlinear, solvable nonlinear"
1050,nontrivial representation,"canonical representatives, functional representation, nontrivial representation, nontrivial representations, odd-dimensional subrepresentation, odd-dimensional subrepresentations, trivial representation"
1051,objects pairs,"object living, objects Continuous, objects pairs, objects quintuples"
1052,objects pairs,objects pairs
1053,obtained,"attained, axioms obtained, doubly indexed, obtain lower, obtained, retained"
1054,orbifold stratad-orbifold,"orbifold effectived-orbifold, orbifold stratad-orbifold, orbifold strataorbifold, orbifold versiond-orbifold"
1055,orbifold version,"orbifold vector, orbifold version, orbifold versions"
1056,orbifolds regarded,"orbifolds considered, orbifolds defined, orbifolds regarded, orbifolds relates, orbifolds replaced, polyfolds remember"
1057,orbifoldsorbifold orbifold,"d-suborbifoldsd-orbifold d-suborbifold, orbifold suborbifoldsorbifold, orbifoldsorbifold orbifold, orientationsorbifold orbifold, suborbifoldsorbifold transverse"
1058,original,"Prikladnaia, horizontal, ordinal, origin, original"
1059,parametrizes,"parameterize, parametric, parametrized, parametrized closed, parametrizes, parametrizes real"
1060,physics,"Physica, Physics, Thesis, physical, physicist, physicists, physics, physicsingo, physicspc, physique"
1061,possibly empty,"possibility suggested, possibly empty, possibly missing, possibly presenting, spacepossibly empty"
1062,precise,"Drechsel, Ergebnisse, Exercise, Precise, exercise, practice, precise, precisely, precision, prerequisite"
1063,primary,"Primary, primary, primary field"
1064,principalprincipal d-manifold,"principal d-manifoldd-manifold, principalprincipal d-manifold, principalprincipal d-orbifold"
1065,priori,"Borisov Bori, Dorizzi, Grigoriadis, fortiori, prior, priori"
1066,productbordism d-orbifold,"groupsbordism d-manifold, productbordism classical, productbordism d-manifold, productbordism d-orbifold, productorbifold orbifold, productsbordism orbifold"
1067,productcategory,"fibre productcategory, product category, product diagram, productcategory, productcategory fibre, propertycategory, pushoutpushoutcategory, terminal objectcategory"
1068,productd-orbifold bordism,"groupd-orbifold bordism, productd-manifold bordism, productd-orbifold bordism"
1069,productfibre product,"dimensionfibre product, productdirect product, productfibre product, productsfibre product"
1070,products b-transverse,"products abzzarotimes, products b-transverse, products b-transversefibre, products bd-transversefibre, products cd-transverse, productsorbifold transverse"
1071,products manifold,"produces singular, product monoid, productd-manifold, products available, products manifold, productsd-manifold, productsmanifold, productsmonotone, projective manifold"
1072,profilegluing profilepolyfold,profilegluing profilepolyfold
1073,proof,proof
1074,proof involving,"FOOO involving, analogue involving, areas involving, controversy involving, diagram involving, geometry involving, processes involving, profilegluing, proof avoiding, proof involving, proof proceeds, proofs involve, proofs involving, property involving"
1075,properly describe,"paper accessible, problems described, procedure described, properly contains, properly describe, properties described, property discrete"
1076,propertycategory universal,propertycategory universal
1077,proportional,"proper initial, proportion, proportional, result proportional"
1078,quasi-smooth quasi-smoothderived,"quasi-smooth quasi-smoothderived, quasi-smoothquasi-smooth, quasi-smoothquasi-smooth derived"
1079,quasi-smoothderived,"quasi-smooth derived, quasi-smoothderived, quasi-smoothderived scheme"
1080,reading,"Orlandini, Standing, abbreviating, binding, dealing, decreasing, grading, gradings, increasing, leading, leaving, meaning, meanings, readily, reading, realize, recalling, reindexing, remains, rendering, sending, shading, shedding, speaking, treating, yielding"
1081,reasonable,"mere expendable, reasonable, reasonable accuracy, reasonable level, reasonably, remarkable, removable, responsible"
